product_name,2022_Q1,2022_Q2,2022_Q3,2022_Q4,2023_Q1,2023_Q2,2023_Q3,2023_Q4,2024_Q1,2024_Q2,2024_Q3
G4Girl Women's Regular Fit Cotton Palazzo,0,0,5,0,4,7,16,2,9,5,4
Priyaasi American Diamond Rose Gold Plated Solitaire Bracelet,0,0,0,0,10,6,7,18,0,0,0
Zeel Clothing Women's Chinnon Silk Embroidered Semi-Stitched Lehenga Choli with Dupatta (105-Pink-New-Bridal-Latest-Leheng...,2,8,16,0,0,5,14,17,15,19,10
The Indian Garage Co Men Sweat Shirt,0,11,4,13,5,11,0,12,1,32,5
Pixievixen Boy's Denim Regular Fit Comfort Flex Waist Relaxed Fit Jeans (Jeans-1105-Black-11-12 Years),0,32,32,12,10,0,2,22,16,7,7
3NH® 2Pcs Stroller Accessories Organizer For Wheelchair Hooks Baby Pram Throne (Imported Item)17497,10,8,6,0,5,0,0,17,0,2,0
AKHILAM Women's Solid Organza Embroidered Saree With Unstitched Blouse Piece (Brown_2NAVYA2010),6,4,13,5,6,0,0,12,7,6,0
brittle Media Streaming Device WiFi HDMI Dongle & Wireless Display for TV/LCD/LED - Black,2,7,0,4,9,6,6,10,5,3,0
Harry Kritz Vertical Stylish 5 Pocket Tote Bag 100% Organic Cotton Canvas Tote for College & Daily Use,0,0,0,0,0,0,0,0,5,0,0
Hush Puppies Men's Miles Thong Slipper,12,9,9,3,15,9,2,0,2,0,0
ZAVERI PEARLS Pink & Green Lotus Design Meenakari Choker Necklace Earring & Ring Set For Women-ZPFK14755,10,9,18,9,5,8,20,8,13,10,2
Sonata Analog Champagne Dial Men's Watch-NL7007YM02/NP7007YM02,12,2,3,23,8,0,5,12,16,1,4
Levi's Men's Cotton Tapered Joggers,6,5,0,0,0,0,0,1,0,0,0
Teat Dip Cup (Green) Non Reflow Nipple Cleaning Disinfection Dip Cup for Cow Sheep Goat by Blisstime,0,0,0,8,0,6,0,0,0,0,0
Red Chief Leather Casual Boots for Men,20,12,0,0,8,25,18,11,34,7,10
Pepe Jeans Innerwear Men's Cotton Brief,4,6,5,11,17,5,4,12,8,5,0
Peter England Men's Slim Jeans (PJDNPSTF628122_Medium Grey_36),6,0,9,0,0,0,0,0,21,3,0
"Bubblegummers Girls Aiden Casual Shoes, Pink, (3595633)",0,0,0,0,1,14,0,0,0,0,0
Rajnandini Women's Rayon Slub Jaipuri Bandhani Printed Kurti (JOPLJPR13-P_Orange_P),4,0,6,4,8,9,16,13,2,5,0
Gem Stone Factory Natural Pyrite Raw for Attracting Wealth & Business Luck 200 gm - Vastu Fengshui,19,15,17,1,0,3,8,17,12,5,17
"Action Pro Silicone Cover Side Frame Case Compatible with Gopro Hero 7 6 5, Action Camera (Black)",9,2,20,0,15,18,6,41,12,13,0
STORE 2508 Frog Eye Sleep Mask (Green),3,13,19,6,11,6,0,14,1,0,0
7SEVEN® Compatible for Samsung Smart 4K Ultra HD TV Monitor Remote Control Replacement of Original Samsung TV Remote for L...,5,0,4,5,20,2,3,0,6,8,0
Bon Organik Kids Mask AV 3 layer BFE 99.94% Reusable Mask (Set Of 2),2,0,13,5,6,17,7,6,0,6,0
ACCOX Men's Long Full Sleeves Regular Fit Cotton Linen Formal Plain Shirts(GCR54),3,6,0,8,8,8,4,5,4,11,0
YESSBENZA Women's and Girls Faux-Leather Clutch Handbags Wallet Purses 6 Multiples Cards Slot (Black Pinks),3,3,11,10,0,0,0,4,0,0,0
Senslife Wine Satin 3/4Th Sleeves Solid Robe with Lingerie Set for Women,6,12,9,20,0,0,3,0,0,6,0
"Eco Right Bucket Bags for Women, Stylish Convertible Tote Backpack for Girls",12,11,49,3,11,2,9,12,15,4,0
Konvio Neer High 3000 TDS Membrane Spare for All Type of RO Water Purifier (Service Kit 100 GPD),0,0,14,0,5,0,0,19,5,7,7
FAST GO REMO Men Formal Slip ON Loafers,0,5,19,10,1,5,10,9,4,3,7
AMERICAN CREW Men's Polo Collar Half Sleeve Striped Cotton Melange Colors T Shirts for Men,6,4,0,5,0,0,0,0,0,0,0
Aerosoles Women's Fibbie Flat Sandal,8,11,3,0,0,10,10,7,7,22,0
Spykar Men's Slim Shirt (62052000_Khaki L),0,10,0,0,0,13,3,0,7,14,5
Avsar 14k (585) Yellow Gold Pendant for Women,15,0,4,0,0,7,12,3,0,5,4
THE NORTH FACE Men's Ultra 111 Waterproof Hiking Shoes,10,15,0,2,1,0,2,10,0,10,14
TJ Atta Dough Kneader Maker Kitchen Set with Measuring Cups Automatic Atta Roti Dough chakki clearline Maker Measuring Cup...,8,21,8,4,8,20,2,4,9,9,0
HiloRill Lingerie Lace Babydoll 2 Piece Sexy Brasso & Net Blended Bra and Panty Sets,7,12,10,0,17,10,6,12,7,26,0
KAYU™ Boys Snowfall Solid Regular Fit Full Sleeves T-Shirts {Pack of 2},14,8,16,10,11,6,7,13,5,5,5
ISLAHE NAFS-REMOVE BAD HOBBYS,11,0,10,2,0,6,7,0,3,2,4
Jockey Womens Printed Solid and Stripe Hipster Brief Pack of 3,19,12,6,17,3,0,3,7,16,9,12
Madame shell drop metal coin chain necklace,17,3,27,17,0,23,0,22,6,12,6
MUTAQINOTI Men's Black Oxford Style Luxury Leather Handmade Shoes for Men Formal Office (MQVX) (Goel),18,5,23,15,0,18,16,2,10,14,0
Ubersweet® Imported 7DEC Retro Sunglasses Anti-UV Wine Red Women's Mirrored Sun Glasses Outdoor,0,0,0,1,0,0,0,0,15,0,0
MX HIGH Performance Speaker Cable Transparent 21 Wire OD 2.5 X 5.0 MM 50 MTR COIL-MX-3981,0,8,0,15,5,0,0,0,10,0,0
ASTRID Multicompartment Bag For Women And Girls With Extra Strong Zipper.,0,7,0,1,0,0,4,0,9,5,9
TIMEX Analog Silver Dial Unisex's Watch-TW00PR213,3,0,4,0,7,0,17,3,13,8,0
"IFFCO Waste Decomposer 5 Bottles | Organic Waste Decomposer for Agriculture, Plants, Gardening, and Farming | Compost Make...",4,5,5,9,5,11,6,0,6,0,6
CaseBase Premium Cover for Apple Airtag 2021 | Metal Case with Strong Magnetic Lock with Carabiner Hook | (Red),6,0,3,0,6,17,0,4,0,1,0
Rider Women's T-Shirt (RD-100.._Black_X-Large),10,0,0,7,0,0,0,0,0,0,5
Krazon Formal Mens Shoes,8,4,13,8,0,3,0,0,0,5,0
RIBRONA Women's Digital Printed Poly Georgette Semi Stitched Lehenga Choli and Dupatta Set,15,10,9,3,8,4,8,15,17,13,4
BASICS Casual Checked Pink 100% Cotton Slim Shirt -22BSH48592,6,4,17,0,6,10,12,10,4,0,0
Bon Organik You Make Me Happy Matching Couples Valentines Day Printed Cotton T-Shirt and Crop Top for Men and Women,6,7,4,6,0,6,0,0,6,10,15
Daniel Klein Analog Silver Dial Women's Watch-DK.1.12563-2,8,10,0,13,2,3,6,6,8,3,0
Prince ENT'S Analog Women's Wrist Watch,0,10,15,0,8,0,7,15,7,5,0
"Skincare Fridge, Mini Fridge Large Capacity 48W 10 Liters 220V Foldable Handle for Car EU Plug",0,0,9,9,0,2,6,0,0,1,0
HIGH STAR Men Blue Slim-Fit Jeans,15,21,19,13,22,14,17,5,4,15,7
LeCalla 925 Sterling Silver BIS Hallmarked Zircon Stud Dangler Earrings for Women,0,0,0,7,0,0,14,0,0,0,0
DOLLFASHION Cancan Skirts White with Wedding Gown Wedding Lehenga Under Skirt Hoop Skirt 2 Layer White,0,0,15,0,0,0,0,0,0,0,0
OORA Men Running Shoes,6,10,14,10,0,12,0,6,3,5,0
VMS INDIA Waterproof Foldable Large Travel Storage Bag Luggage Organizer Dark red,5,8,5,9,4,0,7,7,0,6,0
"Lifelong LLS27 Face, Nose and Cough Steamer|3 in 1 Plastic Steam Vaporizer|Nozzle Inhaler, Facial Sauna and Facial Steamer...",5,15,15,9,5,5,22,12,0,11,0
Chumbak Teal Regal Elephant Tote Bag - Teal,0,3,0,12,3,12,6,6,10,6,0
Amble Men's Outdoor Sneaker Shoes,16,12,31,14,11,11,26,9,23,6,6
SPOTIC PU Synthetic Leather Stylish Fashionable Satchel Gold Chain Strap Travel Shoulder Flap Closure Hobo Shoulder Daytri...,0,0,0,0,0,0,0,10,0,14,0
NEUTRON Branded Analog Blue and Silver Color Dial Men Watch - BL46.24-(54-S-19) (Pack of 2),0,5,0,5,0,4,5,0,5,0,0
Jaipur Mart Ethnic Collection Beaded Bracelet for Men (Multi-Colour)(RKH32CMB),0,0,0,0,0,7,0,0,9,0,0
RATAN Georgette Straight Lucknowi Chikankari Ethinic Wear Kurta for Women,9,0,8,0,1,9,0,7,0,7,4
CALANDIS Clear Disposable Underwire Bra Women's Full Cup Push Up Bras Adjustable 40E,10,6,10,13,6,0,14,8,5,9,0
"ST. D'VENCÉ Autumn Edition Body Lotion with Argan Oil and Avocado Butter for Very Dry Skin, 300 ml",4,13,8,9,0,10,6,0,0,0,0
Chicnutrix Bounce - Biotin With Selenium and Amino Acids - Hair Fall & Hair Growth Management - Strong Hair - Frizz-free H...,0,6,11,17,1,0,0,2,7,7,9
Mens Fashion Jewellery Fancy Unisex Style Multicolor Lord Shiva Rudraksha Bali  Earring,3,26,23,15,7,16,4,2,20,14,0
El Regalo 2 PCs Healing Pure Copper Adjustable Unisex Bracelet kada Set for Men & Women - Copper Bracelet for Arthritis Re...,4,9,7,9,16,17,0,4,0,8,2
"KEBILSHOP 3.5 mm Jack Stereo Audio Aux Male to 2 RCA Male Cable for Smartphone, Black (10 Meter)",17,3,0,20,13,0,2,19,0,5,0
Trendy Store Women's Jacquard Silk Blend Saree With blouse piece,20,12,10,5,0,13,29,14,2,0,12
Pack of 2 King Queen Black Metal Strap Couple Analogue Men's & Women's Watch,3,8,0,19,13,7,2,13,2,6,0
Peiroks LTG to USB Cable for Fast Charging Compatible for Phone 5/ 5C/ 5S/ 6/ 6S/ 7/8/ X/XR/XS Max/ 11/12/ 13 Series and P...,5,7,3,0,12,0,5,21,0,4,3
"HAP Men's Modern Trunk, Drawer, Boxer Brief,Square Cut Trunk (Multicolor Pack of 5)",0,0,10,0,7,2,0,0,0,9,0
SAHVI HANDICRAFTS Earrings Combo Girls/Women's Twisted Leafe Shape Glass Bead Dangle Earrings Combo Set Pack of 12 Pairs (...,8,18,7,8,8,0,9,6,7,6,0
New Ware® Multipurpose Hose Pipe for AC Outlet Drain Water 5 Meter,26,21,6,10,14,19,7,6,12,19,0
Dixcy Scott Men's Innerwear Regulart Fit Solid Vest (Pack of 2) (K1-PR43498M_White_L),4,13,10,0,7,18,10,0,7,0,5
"Little Peaches Pure Cotton Terry Baby Burp Cloths/Napkins for Babies, Baby Burpies (Pack of 4)",0,24,12,12,5,10,3,20,5,4,20
"Kajal Dream Cool Water Purifier RO Cover for Aquaguard, Kent Grand, Kent Pearl Ro Body Cover for Kent Grand Plus -08",11,0,0,4,0,1,3,6,13,0,0
Metro Women Synthetic Sandals (41-3922),3,14,2,3,0,10,9,0,6,26,6
"DHRUVI TRENDZ Women Printed Top with Half Sleeves for Office Wear, Casual Wear, Under 399 Top for Women/Girls Top",20,7,17,12,7,16,13,21,14,5,11
creeper Women's Handbag/Shoulder bag With 3 Zipper Pocket,7,9,0,1,4,0,0,5,0,0,5
Rajnandini Women's Magenta Cotton Printed Unstitched Salwar Suit Material,1,7,0,0,4,6,7,4,5,8,0
MOKSHA Analogue Men & Women's Couple Watch (Black Dial Gold & Black Colored Strap) (Pack of 2) IIK,4,0,0,0,0,0,0,0,0,0,0
"berge' Mens Polyester Dry Fit Collar Polo Tshirts for Men, Quick Drying & Breathable Fabric,Anti-Static, Gym Wear Tees & W...",6,16,12,12,35,0,0,13,3,0,0
Kirti Sales Gems 10.25 Ratti Neelam Stone Certified Natural Blue Sapphire Birth Stone/Rashi Ratan/Gemstone for Astrologcal...,12,7,6,12,16,11,4,25,0,10,11
Am Drop Shape Crystal Edged Stones/Kundans For Jewellery Making/Decorating & Crafts. Pack Of 700 Stones (7 Colors),6,14,6,1,12,0,3,3,9,0,0
"Desview T3 Teleprompter Desview T2 Broadcast Teleprompter 2021 New Model for Phone Tablet DSLR Cameras, More Flexible Phon...",0,2,14,4,7,16,9,16,10,10,5
Cattails Women Casual Block Heel With Buckle Clouser (FF-D-1124),0,0,14,0,0,0,0,7,0,8,7
RUDRADIVINE Unisex Brown Rudraksha 2 and 5 Mukhi Face Beads Mala Wrist Band,4,0,9,3,3,22,0,11,3,0,0
CHKOKKO Men Cricket Polo Tshirt Uniform Jersey,0,9,1,0,0,17,20,10,9,8,9
BigPlayer HDMI 3-in 1-Out HDMI Auto Switch with 1.5 feet Cable - Supported high Definition Television Allowing Connection ...,8,6,5,6,0,5,0,0,5,2,0
"(Renewed) boAt Rockerz 255 Pro Made in India in Ear Bluetooth Neckband with Upto 10 Hours Playback, ASAP Charge, IPX5, boA...",6,8,13,18,1,1,8,5,6,7,9
BATA Comfit Women's Slip On Flat Ballerina,11,2,14,8,4,13,0,0,0,17,0
Bansal Sports Nylon Shuttlecock (1 Box of 6 Shuttle Pieces)-124,7,12,11,9,4,10,5,14,26,10,5
"Boldfit Skipping Rope for Men and Women Jumping Rope With Adjustable Height Speed Skipping Rope for Exercise, Gym, Sports ...",8,0,3,13,21,10,12,2,17,6,0
Daniel Wellington Classic Petite Analog White Dial Women's Watch-DW00100219,0,11,4,15,3,3,9,11,8,7,6
PC Jeweller The Amrita 22 KT Yellow Gold Earrings,0,10,10,7,20,5,0,0,8,10,0
AASONS Multi Angle Triangle Welding Positioner Magnetic Welding Holder Set Fixed Angle Soldering Tools For Fabrication And...,0,9,6,1,0,0,2,5,0,0,0
Puma Mens Speed Sutamina Running Shoe,10,0,3,16,0,7,5,10,6,0,6
KOSHIYA Fancy Magic Umbrella Changing Secret Blossoms Occur with Water Magic Print 3 Fold Umbrella for Women Men and Child...,3,3,0,4,11,3,14,0,0,0,6
"Bitpro Newly Launched Wyzer Bluetooth In Ear Neckband with Upto 150 Hours Playback, Fast Charging, ENC, IPX5, Dual Pairin...",0,5,0,0,0,0,0,0,0,5,0
Jack & Jones Men's Cotton Blend Classic Boxer Shorts (Pack of 1) (168998301-BRIGHT White_Bright,0,12,0,0,4,0,0,0,0,2,0
Van Heusen Men's Cotton Briefs (Pack of 2),3,0,0,0,6,0,0,0,0,5,0
Longies Women Shorts,6,0,2,10,0,6,5,0,0,5,0
REZARGE Heavy Duty Aluminum Alloy Black Photography Tripod LED Light Stand with Mobile Holder and Connector for Photo and ...,0,11,0,0,0,0,3,0,4,9,0
PC Jeweller The Elynn 18KT Yellow Gold and Diamond Ring for Women,0,16,3,0,17,6,9,26,3,6,8
"Philips Avent Comfort Manual Breast pump, Natural Motion technology, combines suction and nipple stimulation, soft cushion...",0,20,0,7,1,14,2,0,5,0,0
Krishmam Fashion Kanchivaram Jacqard For Women saree With Unstitched Blouse,11,4,2,0,9,23,9,9,11,4,8
NEUTRON Traditional Analog Black and Rose Gold Color Dial Girls Watch - GCPL18-GX7 (Pack of 2),5,1,0,4,16,25,15,6,22,26,0
Zen Bells 9 Beads Natural Rudraksha Fruit - Nepali Original Rudraksh Beads with Natural Shell for Rudraksha mala Rudraksha...,6,0,8,0,0,0,0,15,0,5,0
Red Chief Leather with Lace Casual Shoes for Men RC2020,0,0,0,4,0,2,9,0,0,4,0
Yellow Chimes Bangles for Women and Girls Traditional Silver Oxidised Bangles for Girls Temple Bangles Birthday Gift For g...,7,0,0,5,0,4,10,0,0,0,11
BabyMoon Strechable Bodysuit & Cap for Baby Boys Photography Photoshoot Props Costume,3,0,1,0,7,0,16,4,13,2,0
RAMRAJ COTTON Mens Regular Collar Half Sleeve White Shirt,0,12,23,8,23,10,0,5,20,14,0
Nike AIR Force 1 LV8 (GS)-DM0983-100-WHITE/BLACK-DARK Sulfur,0,0,0,0,0,0,0,0,0,8,0
"AGARO FS2117 Facial Steamer With Nano Ionic Hot Steaming Technology, Hot Mist Moisturizing, Opening Skin Pores, Home Sauna...",7,22,19,19,50,2,25,34,13,7,6
Comfort Lady Women's Straight Fit Black Pant Free Size,23,14,17,15,2,6,5,2,22,0,0
"Mahi Cross Leaves Collar Pins Set for Formal Shirt ,Blazer for Men (PACP1101104PR)",6,0,7,2,0,0,0,0,7,0,0
CLYMB Men's AIR MAX Mesh Lace-Ups Walking/Outdoor/Gym & Traning/Running Sports Shoes,8,0,0,3,0,0,0,7,0,0,0
"rts High-Speed HDMI Cable – 20 Meter (Latest Version Standard) Supports Ethernet,1080p full HD, 3D, 4K 60Hz video, Audio R...",8,2,0,15,0,21,2,21,0,4,3
Power Men Engage Zero Ii Grey Training Shoes-9 (8082200),18,3,6,34,7,16,4,10,6,23,3
"® 6 Inch Spun Filter for Pureit Classic RO+MF, Pureit RO+UV (Pack of 2)",4,4,6,0,5,0,4,9,0,17,4
VOKAN women backpack bag 15 L Backpack Medium 15L Backpack Cute Style Female Student Waterproof (Black),2,2,11,8,11,15,4,0,10,25,5
ZAVERI PEARLS Chain for Women (Golden) (ZPFK9874),19,1,5,12,14,0,21,3,2,11,5
Baggit Women's 3 Fold Wallet - Small (Green),0,0,5,5,3,4,0,0,25,2,0
Amazon Brand - Solimo Back Cover Case for Realme 6 | Compatible for Realme 6 Back Cover Case | 360 Degree Protection | Sof...,5,8,0,10,0,6,0,0,0,0,0
Diverse Men Front Zipper Hooded Sweatshirt,0,9,4,1,0,0,0,2,0,0,7
Sunshades Reading Glasses Light Brown with Box and Cleaning Cloth +1.00 +1.50 +1.75 +2.00 +2.25 +2.50 +2.75 +3.00,0,0,0,0,0,0,2,0,4,0,0
MONKS & KNIGHTS Basil Green Suede Leather Loafer for Men Moccasin Shoes (MKSUMCGR),3,13,0,0,7,8,0,0,8,6,8
INNERSTYLE Women's Cotton Floral Printed Hipster Panties Combo Set Briefs Underwear for Ladies Panties - Pack of 6 (Multic...,0,0,9,0,3,7,0,10,0,0,0
"Van Heusen Athleisure Men T-Shirt - Cotton Rich - Smart Tech, Easy Stain Release, Anti Stat, Ultra Soft, Quick Dry",0,10,12,20,14,17,3,6,10,17,0
YSCROWD Men's Sneakers Trending Casual Grey White Shoes,0,0,8,0,0,0,0,0,0,0,0
CALANDIS Single Row Slide Sliding Linear Potentiometer Analog Sensor Module,2,8,12,6,15,10,0,0,6,6,13
"LuvLap 9 in 1 Baby Food Masher Mill, Food Grinder Cum Processor, with Multifunction Textured Mashing & Filtering Plates, w...",11,8,0,7,10,0,0,5,0,13,0
Casio G-Shock for Women Analog-Digital Black Dial Women's Watch GMA-S140M-1ADR(G1060),13,15,22,5,0,7,4,0,0,16,0
"Vanya Handicraft Collection LONGING TO BUY Baby Bag for Mother, Mother Bag, Diaper Bag for Girls and Boys (Baby Pink)(Pack...",7,0,0,0,8,8,15,0,4,4,0
"Panasonic 7 kg 5 Star Semi-Automatic Top Loading Washing Machine (NA-W70E5RRB, Red, Powerful Motor, Active Foam System, Ef...",9,0,22,3,16,22,12,3,11,6,0
kamison INTERNATIONAL LINGERIE Women's Cotton Panty for Women Underwear Daily use Combo Pack of 3 (Prints May Vary),5,6,0,0,0,8,0,0,0,11,7
Bourge Boys Orange-z26 Running Shoes,24,15,27,17,11,28,18,0,9,13,0
ELLITI Women's Skinny Fit Denim Capris,5,4,8,16,9,28,16,4,14,7,0
"Li-Ning Cloud ACE III Men's Non-Marking Badminton Shoes (UK 7, AYTP081-1 Black/Red)",0,23,6,17,4,18,18,6,9,19,14
Caprese Womens Faux Leather Olive Large Tote Bag,3,3,9,2,0,0,2,0,0,0,0
"Seagate One Touch 1TB External HDD with Password Protection – Light Blue, for Windows and Mac, with 3 yr Data Recovery Ser...",6,12,0,0,0,0,0,11,5,3,0
AONES Pack of 2 Silicone & Metal Chain Belt Watch Strap Compatible for Samsung Galaxy Watch Active 2 44mm Watch Band Black,19,2,15,32,17,26,6,25,26,23,5
Axter Multicolor Men's Casual Sports Running Shoes (Set of 2 Pair) (2)-9064-9311,4,2,12,0,3,6,0,5,0,0,0
SEGA Primer 2023 by Star Impact Pvt.Ltd.,29,15,7,14,20,16,7,23,11,0,0
SONA Women's Cotton Full Cup Minimiser Non-Padded Non-Wired Bra (White) Pack of 3,6,6,0,15,8,17,0,5,11,0,0
Vector X Blaze Football Shoes,14,13,12,0,26,14,31,5,5,2,0
Magic Filter for LG Fully Automatic Washing Machines/Dust Filter/Lint Filter/Waste Collector/Drain Jali for Washing Machine,0,7,0,0,0,0,0,0,0,0,0
"Geifa Women Anti Bacterial, Bamboo,Panty, Women Bikini Brief, No Itching, Daily use Underwear, Odour (Pack of 3)",6,0,5,6,0,0,1,4,4,11,0
Jewels Galaxy Multi Layered Lather Bracelet For Men,13,3,5,11,7,0,0,15,13,14,0
Aaparam Fashion Women's Banarasi Kora Silk Jacquard Woven Self Design Dupatta,12,24,22,28,4,0,8,14,20,26,3
Nivia Men's Arnold Mesh PU Black and Yellow Running Shoes - 7 UK,0,0,2,12,0,0,8,0,7,4,0
Vish Small Sling Crossbody Messenger Travel Shoulder Bag for Passport Bag for Men & Women Stylish,0,0,0,0,0,0,6,0,0,0,0
Schsteindar® Combo for Nikon D7500 (HB-32 Lens Hood + 67mm UV Filter + Lens Cap and Tempered) Compatible for Nikon with A...,7,9,6,15,0,0,14,10,0,9,8
Woodland Men's Leather Hiking Boots,0,6,4,9,6,2,6,7,2,15,6
"TDO Silica Gel Packets 250 pcs (Each 2 Gram) For Moisture absorbents Dehumidifier Silica Gel Bags for Moisture Room, Cupbo...",7,4,5,6,13,0,3,2,0,0,0
Aquadyne Carbon Block Filter Compatible for Pre filter in Pure-it Water Purifiers,5,9,9,0,0,17,7,4,12,0,9
"Proaim SnapRig L Bracket Compatible with Sony a1, a7S III, a7R IV, and a9 II LB206 | Adds Better Grip & Versatility-Horizo...",15,15,5,8,10,11,4,0,9,18,7
RR SA KURTIS Womens Round Neck 3/4 Sleeve Casual Cap Sleeves Embroidered Tops For Womens and Girls Peach XXL,34,0,7,4,8,7,7,13,6,3,0
FORTIVA Stylish Running Shoe| Walking Shoe| Tracking Shoe for Men's & Boys,8,34,17,14,9,27,0,16,39,20,6
AKSHITA GEMS 5.00 Ratti /4.50 Carat Natural Certified Emerald Panna Gemstone Gold Plated Adjustable Ring for Women and Men,5,24,0,7,7,9,20,21,7,20,0
Platoon Boots TAN EU 43 / UK 9,6,0,0,0,0,6,0,9,0,0,0
Nasher Miles Texas Expander Soft-Sided Polyester Cabin Luggage Olive Green 20 inch |51cm Trolley Bag,0,0,0,0,0,2,0,0,0,0,0
CHUTNEY JAR,6,5,10,0,0,0,0,6,0,0,0
"TRAY Automatic Plastic 360 Degree Rotation Cereal Dry Food Rice Grain Storage Dispenser Box , with Measuring Cup , 10 kg ,...",0,1,6,0,4,4,5,4,0,0,0
VIROKASH 360 Degree View Smart WiFi Wireless IP CCTV Security Camera with WiFi Wireless Connectivity | Night Vision | 2-Wa...,0,20,2,17,7,44,14,13,12,9,6
"YIPSY Men,s Synthetic Leathe Classic Designer Boot's",0,0,0,0,0,0,0,0,5,0,3
Urbano Fashion Men's Slim Fit Jeans,15,0,5,4,4,11,8,20,0,12,0
ADBUCKS Silky Cotton Denim Jeans for Women's Stretchable (Plus Size Also Available),7,0,6,0,0,2,7,7,11,6,0
"QUAINT White Fisheye Panoramic VR IP Camera WiFi Wireless 360 Degree 3D 1-3MP Network Camera, (Pack of 2)",0,9,0,6,0,0,8,0,5,0,0
Ultralinx NB-9 in Ear Bluetooth Wireless Earphones | Neckband with 20 Hours Music Play time and Noise Cancellation (Mettal...,0,0,0,2,12,12,12,4,0,0,0
"Smart Pro NB-9L Charger for Canon PowerShot N, N2, SD4500, SD4500 is, ELPH 510 HS, ELPH 520 HS, ELPH 530 HS Camera Battery...",0,5,7,0,17,0,15,4,8,7,0
Women's Regular Fit Lounge Pants and Trainer Pyjamas,8,11,0,6,0,0,2,9,0,2,4
Nelle Harper Women's Handbag,3,6,10,0,0,0,4,0,0,26,0
Tommy Hilfiger Analog Blue Dial Men's Watch-TH1791399,0,4,0,0,4,7,0,2,8,0,0
Axter Men's Latest and Exclusive Collection of (1266) Black Formal Shoes,0,0,11,0,0,2,0,0,4,0,0
ELECTROPRIME Fashion Men Time Rotating Ring Titanium Steel Arabic Numerals Calendar Ring L4I9,0,7,15,8,11,4,9,17,4,5,0
"BANCROFT Men's Lycra Ultra-Soft Ice Silk Stretch Solid Briefs Boxer Short Underwears Ideal for Working Out, Running, Skiin...",0,11,0,0,7,0,0,1,0,0,0
Peter England Men's Cotton Slim Shirt (POKUOLSPV22785_Yellow_M),9,1,4,2,5,15,4,12,31,8,16
Amazon Brand - House & Shields Men's Co-ords Set,11,13,10,12,8,7,2,14,15,19,3
U.S. POLO ASSN. Men Polo Shirt,0,3,16,5,7,11,6,11,0,2,3
Hospitime Laryngoscope Spare LED Bulb (Lamp) - 10 Pieces,0,0,0,8,3,0,0,0,4,7,0
Meenakari 925 pure Sterling Silver beads & Evil eye adjustable black thread Nazariya Payal (anklet) for Women & Girls,11,21,9,8,16,15,18,19,20,14,0
Lee Men Jeans,25,21,39,14,12,18,11,16,20,31,11
Runbugz Safe Natural Mosquito Repellent Patches for Kids|30 Patches-BOOK3,2,4,0,19,0,0,7,0,0,5,0
Cread Craft Winter Wear Men's Poly Cotton Thermal Set (Round Neck Upper /Top + Lower/Trouser ) Set of 01,0,0,6,2,4,0,6,0,0,0,0
KAYU™ Boys Snowfall Solid Regular Fit Full Sleeves T-Shirts {Pack of 4},0,0,4,3,0,0,0,3,0,0,0
"MASQ By Q-One 4 Layer Washable, Reusable, Size Adjustable, Anti-Bacterial (BFE>99%) Embroidered Cotton Cloth Face Mask Com...",13,0,0,0,0,0,10,10,5,3,1
AELOMART Men's Cotton T-Shirt,4,2,0,7,12,5,3,0,0,7,0
U.S. POLO ASSN. Men Rust Solid Cotton Corduroy Casual Shirt,15,15,14,4,5,0,20,16,22,1,1
JEKE Latest Lightweight Comfortable Socks Shoe Running Shoe for Men (MOJRI),5,5,9,6,5,5,20,7,0,18,0
"BSB HOME® 100% Cotton Ultrasonic 280 Tc Solid King Size Quilted Bed Cover/Bedsheet with 2 Pillow Covers, (Luxurious, Sky B...",5,1,6,12,5,10,3,5,23,0,3
JUST RIDER Sweat Wicking Cooling Helmet Liner - Do Rag Skull Cap Beanie for Men & Women. Pirate Hat Bandana & Head Wrap fo...,7,18,7,9,5,4,5,0,11,12,6
"Wowon Art Dual Tip Water Based Brush pen,Art Marker,Fineliners, Calligraphy,Sketching,Drawing,Colouring Book,Bullet Journa...",0,13,0,6,0,4,0,0,0,7,0
"""OXFLOW RO Heavy Duty Transparent Uncrackable Leakage Free Blue Pre Filter Housing 10"""" with 10"""" PP Spun Pre Filter and Fitt...""",14,2,0,1,4,15,0,3,14,8,0
Hush Puppies Mens Charles Weave E Red Oxford - 7 UK (8345680),0,11,11,0,19,6,10,17,12,13,0
Jewels Galaxy Jewellery For Women Gold Plated Layered Necklace,8,0,0,0,0,13,0,10,8,22,0
Vaamsi Women's Poly Silk Yoke Design Sequinned Kurta Trousers with Dupatta (PKSKD1633_Black),41,0,12,28,9,13,7,10,20,15,2
Enamor F035 Minimizer Full Support Bra - Non-Padded Wired High Coverage - Black,0,0,0,0,0,0,0,3,0,0,0
"Storage Box for DJI OSMO Action 3 Adventure Combo Water Proof Carry Case Shock Proof Action Camera, Hub Perfect Fit Bag : ...",5,4,7,9,13,9,5,5,11,5,0
Club A9 Womens Regular Fit Printed Shorts(Pack of 2)_WSCOM2(300)_Navy Blue & White,0,9,0,11,5,4,17,7,4,6,5
Zeya Yellow Gold Ring,28,21,5,12,0,18,0,0,20,3,0
Intex 80 cm (32 inches) HD Ready Smart LED TV Smart LED-SHF3291 (Black),3,12,6,5,0,7,9,0,10,3,0
"Femezone Women's Rayon Angrakha Pattern Anarkali Kurti Pant and Dupatta Set(Angrakha Pompom) (XXX-Large,Blue)",8,0,3,9,0,14,4,3,12,6,0
"Cello Infuse Plastic(PET) Water Bottle with Infuser, 800ml, Set of 2, Orange",0,0,0,6,5,10,10,3,9,6,0
COMPATIBLE FREEZER DOOR,10,5,6,14,33,17,15,4,12,3,0
M MODDY Wide Leg Women Blue Jeans,6,6,0,10,12,10,13,10,18,10,0
Allin Exporters J-1903 Industrial Humidifier with UV Sterilization Commercial Ultrasonic Air Purifier with Remote Control...,6,7,0,0,13,11,0,9,6,7,0
"AVEDIA Sink Water Filter Faucet, Faucet Filter, 360° Rotating FaucFilters Purifier Kitchen Tap Filtration Removes Chlorine...",0,0,13,7,8,7,7,0,6,0,0
Knighthood Golden Air Plane Lapel Pin Badge for Men,0,3,0,3,0,0,0,0,0,0,4
LUCASI Casual Analog Multi-Colour Dial Women Watch - ZMNX-158,13,19,0,9,15,0,20,8,0,7,6
ZOUK Women's Handcrafted Mughal Art Multicolor Side Tote Bag and Handbag for Office and College,10,3,8,18,1,8,7,8,14,12,2
Metro Men Mocassin (19-6625),0,0,9,0,0,0,0,0,0,0,0
"Just Herbs Ayurvedic & Vegan Rose Lip Scrub & Lip Mask duo pack for Chapped, Pigmented & Dark lips,30gm",11,1,19,10,6,14,3,6,7,0,19
Zeya Yellow Gold Ornament Earring Stud Earrings for Women,27,0,22,20,14,6,5,1,3,0,0
"TIMA 1117 Polyester Elastic Knee support Compression Bandage Wraps for Legs, Thighs, hamstrings Ankle & Elbow, Elastic Wei...",6,14,9,11,14,6,0,18,8,23,2
SNISHET Fashion Hot Release Women's Organza Silk Embroidery Work Unstitched Salwar Suit Dress Material With Border Work Du...,0,3,4,0,0,10,0,0,11,22,0
"Van Heusen Men Trunks - 100% Combed Cotton - Plush Back Elasticized Waistband, Double Layer Gusset, Solid_70002_Grey Melan...",3,0,2,0,3,8,0,9,8,0,0
Pets Empire Stainless Steel Classic Dog Bowl - Mirror Finish 2800 ML,0,4,13,13,7,5,25,0,5,7,6
DEVAMA THE DIVINE® Meru Tortoise Ring/Turtle Ring/Kachua Ring Made in Panchdhatu Adjustable Ring with Studded Green Ziircon,12,5,4,7,15,8,23,9,11,18,0
AEIDESS Tempered Glass Screen Guard Compatible for OnePlus 7 Pro / 7T Pro with Edge to Edge Full Screen Coverage With Inst...,14,4,8,8,5,12,6,10,7,6,0
TechLife-Original 3D Printed Wall Mount for P. S. 4 Pro (Playstation 4 Pro) - Wall Mount for P s 4 Pro + Controller + Head...,0,0,0,5,0,4,0,4,4,0,0
KAYU™ Womens Fleece Warm Neck Printed Kurtis for Winters [Pack of 3],13,9,8,13,11,16,15,35,25,13,0
LOUIS STITCH Men's Tortilla Brown Handcrafted Leather Shoes for Men Tassel Loafers (Czech_RGMCPTA) (Goel),0,0,0,0,2,0,6,8,0,0,0
MHT 3PCS Detachable Jean Buttons Removable Reduce Waist Size for Cowboy Clothing Bronze English,1,10,6,17,13,19,13,10,9,37,0
"Encanto Skipping ropes, skipping rope for men women boys girls, gym, workout weight loss_ENC_FITNESSKIT_19",16,18,11,27,3,11,17,3,34,0,7
The Souled Store Men Official Courage: Face Sky Blue Printed Oversized T-Shirts,9,5,0,0,5,9,3,6,29,0,3
PC Jeweller The Rozsa 18KT Yellow Gold and Solitaire Necklace for Women,3,12,11,19,0,9,5,0,0,16,0
"SKYCELL 360°Rotatable and Retractable Car Phone Holder, Multifunctional Adjustable Mount, Universal Rearview Mirror Phone ...",4,0,0,0,0,0,8,4,0,6,0
Pets Empire Japanese-Style Bow Puppy Cat Collar PU Collar Bell Bow Pet Cat Tie Adjustable Neck 17-24cm Width- 1cm ( Red ),8,0,0,4,0,15,5,7,0,0,0
