TheGiftKart Flip Cover Back Case for OnePlus Nord CE 2 LITE 5G | Dual-Color Leather Finish | Inbuilt Stand & Pockets | Wal...,20,0,15,9,6,7,4,24,13,6,2
Tobo HDMI Extender Over Single Cat 5E/6 60M Support Full HD 1080P 3D HDCP EDID Ethernet LAN Cable Switch Network RJ45 to H...,17,7,16,9,4,7,23,22,10,0,0
Tata Cliq Online E-Gift Card - Flat 5% off - Redeemable Online,2,0,8,0,8,0,7,0,2,10,0
Studio Shringaar Women's Georgette Elbow Length Sleeves Chikankari Saree Blouse,4,5,0,0,7,0,5,2,0,0,9
Uniform Sarees Corp Women's Small Print Silk Crepe Front Office Uniform Sarees With Blouse Piece,0,0,27,5,4,0,7,12,10,0,0
LE BOURGEOIS Men Solid Full Sleeve Casual T-Shirt,7,12,7,0,9,8,0,7,4,0,0
Lux Cottswool Black Thermal Men's Pyjama Size 90,0,6,0,5,0,5,5,8,1,11,0
Multifunction Smash Machine Spice Grinder Portable Electric Grain Mill Grinder Stainless Steel Dry Grain Spices Cereals Se...,0,0,0,4,3,0,0,0,0,0,0
"Bolt SF-400 Electronic Kitchen Scale, Capacity - 10 Kg (White)",5,6,0,0,5,4,4,8,0,5,0
Shasmi Women's Cotton Stretch Skin Fit Meadow Green Colored Chudidar Full Length Leggings,0,0,3,10,0,0,0,0,0,10,0
LEVANSE Sleep-On Formal Executive Shoes for Men's & Boy's,3,12,11,0,8,11,8,2,0,6,0
Women's 100% Cotton Front Zip Full-Length Maternity Nightdresses,0,0,2,0,6,9,0,0,5,0,0
"D'chica Beginners Bra, Sports Bra for Girls Cotton Non-Padded Full Coverage Non-Wired Gym Bra Girls Workout T-Shirt Bra wi...",0,5,0,4,5,5,0,0,0,0,0
BSB HOME Resham Collections 240TC Cotton Printed 1 Double Bed-Sheet with 2 King Size Pillow Covers-(230x240 cm or 45x71 cm...,16,0,0,5,8,5,16,0,4,3,0
Aristocrat Polyester Soft 57 Cms Luggage- Suitcase(Stnilw54Bbl_Blue),0,4,5,6,17,26,5,13,27,18,2
Park Avenue Men's Slim Fit Casual Shirt,5,2,14,9,2,2,8,4,12,4,19
"Apple Earphone with Lightning Connector 6/7/8/X/11/12/13/14 Max Sound Bass (White, in The Ear)",19,3,0,18,10,4,9,0,6,16,4
PC Jeweller The Hans 18KT Yellow Gold and Diamond Ring for Women,3,0,11,0,7,6,7,1,6,6,0
Women's Cotton Nighty (10622) L/XL/XXL Size Red/ Rani Pink/ Purple/ Blue/ Black/Tamato Pink / Maroon,7,8,7,0,23,0,11,12,9,17,4
Amazon Brand - Symbol Mens Atlas Suede Sneakers,10,0,7,0,0,12,3,9,17,21,0
"DSC Intense Pro Leather Cricket Batting Gloves, Mens Right",24,7,7,27,18,20,19,8,21,0,3
"ACCEDO® Polyester 8 inch Travel Duffle Bag for Kids, Sports Bag for Boys & Girls, Overnight Weekender, Picnic, Dance, Swim...",18,25,30,25,7,0,6,8,0,5,25
Kalyani Mid Rise Hipster Panties Pack of 3 | Panties for Women Combo Pack - PV1002,0,0,8,1,8,6,6,10,0,0,6
Arrow New York Men's Regular Fit T Shirt (ANADOTS3730_Brown_M),0,4,15,9,0,5,5,0,4,0,5
Turtle Men Navy Blue Narrow Fit Solid Jeans,6,0,5,0,7,17,6,28,18,14,0
Skechers Mens Mira Casual Shoe,0,0,9,0,24,3,25,18,0,17,4
KITTYBEES Women's Maxi Dress (_blue_),8,4,6,2,8,10,15,7,0,13,2
tZaro Genuine Leather Driving Shoe for Men - STN2311TWNBRW,14,3,0,13,7,0,22,0,17,19,19
Chevit Men's Running Shoe (Set of 3 Pairs),4,0,9,13,33,18,2,2,0,5,0
"EISCO - Newton's Cradle (Collision Balls / Pendulum Balls), 18cmX15cmX17.5cm with 5 Steel Balls of 2.2cm Dia Each ,Perfect...",4,5,3,6,0,5,13,6,3,0,0
Amante Cotton Non Padded Wirefree Full Coverage Everyday Bra,14,9,6,5,5,24,4,4,0,10,0
NEUTRON Exclusive Analog Black and White Color Dial Women Watch - GM346-G457 (Pack of 2),11,6,0,16,10,5,7,14,0,0,4
Running Shoes,1,0,9,13,0,9,0,8,3,13,0
Kitty Fashion Women White Petticoat Layer Underskirt HoopSkirt for Ball Gown and Lehengas,22,6,10,11,13,2,11,13,0,2,0
Sneaker Zig Zag Plus Sports Shoes,8,14,3,2,11,17,12,16,3,9,0
"Reiki Crystal Products Natural Rose Quartz Rough, Raw Stone 250 Grams, Rose Quartz Raw Stones",15,12,10,9,2,29,36,15,32,2,9
"Fun Homes Disney Mickey Minnie Mouse 13 inch Polyster School Bag,Backpack for Kids, Blue (Fun0761)",14,4,23,11,6,4,5,24,6,6,0
"Usha Crisp Air Premia BV 150mm Sweep Size, 8 Inch Duct Size Exhaust Fan (White)",10,0,7,6,5,19,0,0,6,0,0
MATKEWALAZ Women's Cotton Jaipuri Sanganeri Print Midi Long Dress Cotton Printed Maxi Dress A-Line Cotton Gown Dress Maxi ...,8,0,0,9,9,7,8,8,9,0,0
Vembley Silver Plated Pearl Pendant Necklace for Women,0,0,0,0,7,0,0,1,0,0,0
Melbees by Yellow Chimes 18 Pcs Set of Hair Accessories for Kids with Pink Color Hair Clips and Hair Band Assortment Gift ...,2,14,0,8,5,0,18,6,0,9,0
Zebu Women's Printed Capri (Pack of 2 Capri),0,5,5,12,14,6,2,16,0,12,4
"TIMBRESONIC Bounce Plus in-Ear Wireless Bluetooth Smart Neckband Earphone, Ultra-Clear Stereo Sound, Light Weight, with Pa...",5,0,0,0,0,0,0,2,6,5,0
JAINISH Mens Brought Checked Formal Shirts.,6,0,5,14,3,1,0,14,11,0,4
ZAVERI PEARLS Kundan & Beads Enamelling Green Choker Necklace & Earring Set For Women-ZPFK9833,0,0,0,0,0,0,0,0,0,5,0
fasczo-Mens Height Increasing Formal Slip-on Shoes Brown,24,14,4,4,20,7,18,17,5,21,0
Sparx Mens Sm-482 Dark Olive Yellow Running Shoe - 8 UK (SM482OLYL008),0,12,18,13,0,18,4,16,2,11,0
Jack & Jones Men Sneakers,0,0,12,22,0,0,2,4,5,0,0
Knotty Needles Women's Acrylic Cotton Turtle Neck Sweater,0,9,17,9,16,5,7,9,0,15,3
Nike Men Shirt,9,3,10,10,14,10,2,13,25,2,5
"APB estore hand bag for women stylish latest Large Tote Bag for Women with Zip, Stylish Handbags Color Elphant Printed",0,8,0,0,5,0,2,0,18,6,8
Clovia Women's Cotton Printed Top & Pyjama,5,18,0,8,5,6,7,13,14,5,0
C36RG BLK Peach Fosil L_S,4,0,4,4,0,2,0,0,0,0,0
"The Clownfish Genuine Leather Womens Wallet Clutch Ladies Purse with Mobile Slot, Multiple Card Slots & ID Card Window",13,0,0,6,0,8,0,8,0,10,0
CHAKRADHARI Brown Crystal Tiger Eye Japa Mala fo Men and Women,8,10,12,9,21,13,5,11,6,6,7
Apple Lightning to USB Cable (1m),7,0,4,0,0,1,0,0,7,7,0
Levi's Men's Regular Fit T-Shirt,0,9,2,0,6,12,0,3,7,0,0
"Pigeon 1.5 litre Hot Kettle and Stainless Steel Water Bottle Combo used for boiling Water, Making Tea and Coffee, Instant ...",8,23,11,3,0,0,25,9,5,8,0
"SAIYONI Combo Of Cuban Link Silver Plated 18 Inch Chain & 9 MM,8 Inch Bracelet For Boys & Men",9,0,0,0,2,0,0,0,0,0,0
shoexpress Mens Textured Lace-up Sneakers Sneaker,12,0,12,2,0,3,0,0,0,5,0
The Bride Made dulhaniya earrings with maang tikka -Green- womens,10,12,4,6,7,11,9,0,12,7,0
"GOVO GOKIXX 421 Bluetooth Wireless Neckband in Ear Earphone with Mic, 10H Long Battery, 10mm Drivers, Magnetic Earbuds, In...",18,4,19,7,14,0,7,3,21,26,0
PINK Handbag for Girls & Women,2,0,0,2,2,6,11,7,0,0,7
DINJEWEL 6.25 Ratti Certified Natural Blue Sapphire Neelam Silver Plated Ring Panchdhatu Adjustable Ring for Men & Women's,14,5,0,7,0,0,0,15,0,0,0
Lee Cooper Mens Lc4505a Sneaker,0,15,13,19,26,14,12,10,0,0,0
Ready Shop go Luminous Geometric Tote bag,8,10,5,9,9,2,7,14,12,18,0
Crazyink Boys Fleece Hooded Sweatshirt (Printedhoodie_Black_Bts_(8-9)Yr_Pink_15 Years-16 Years),18,0,2,2,6,6,3,0,6,0,6
SJS-Men's Half Sleeve Solid Art Silk Shirt (Beige,0,0,0,8,6,7,0,17,0,0,0
Yellow Chimes Anklet for Women Multi-Layered and Gold-Plated Fashionable Chain Designed Anklets for women and Girls,30,6,5,22,20,6,15,21,10,10,8
Bhuvanesh Enterprises 2inch Clear Audio 3watts 4ohms Loud Speaker Using Electronic Project & DIY Bluetooth Speaker Pack of 2,11,0,0,23,9,0,0,6,7,4,0
Avsar 14KT Rose Gold Nose Ring for Women,6,12,21,0,24,7,20,0,13,14,12
Panasonic HC-V785GW-K Consumer Camcorder with Optical 20x Zoom (Black),0,7,1,0,0,8,0,1,0,0,0
Nykd Women's Cotton Non-Padded Wire Free Full Coverage Bra,20,10,0,0,0,4,5,0,29,3,0
WildHorn� Leather 8.5 inch Sling Messenger Bag for Men I Multipurpose Crossbody Bag I Travel Bag with Adjustable Strap I U...,9,12,7,8,0,2,7,0,0,7,6
"F Gear Circadian Spruce 27 Ltrs Casual Backpack (3729), One Size",14,26,10,29,3,13,10,0,1,8,3
"SATYAM KRAFT 1 Pcs Cute Stylish Animal Keychain with Strap Hook Detachable alloy metal rings Keychains for Kids, Girls, Bo...",10,0,7,28,3,0,8,5,6,28,8
"Voix Flexible Silicone Ice Cube Mould Trays 24 Cavity Ice Cube Tray with Lid (Pack of 3 Tray,Multicolor)",3,0,7,12,4,0,10,3,10,7,0
Mochi Women Light Blue Shoulder Bag (66-7210),14,18,0,7,5,0,0,2,14,0,2
PowerMax Fitness X Marvel Yoga Mat YP61.2 Captain America Marvel Edition Anti Skid Yoga mat with Bag for Gym Workout and F...,0,0,0,2,0,0,0,0,7,0,0
THE BLAZZE Men's Tank Tops Muscle Gym Bodybuilding Vest Fitness Workout Train Stringers,16,12,0,7,21,1,5,11,32,9,0
Indian Sports INDICO Classic Badminton Racket (Multicolour) -4 Pieces,2,0,0,0,18,7,0,0,0,8,8
Dennis Lingo Men's Striped Slim Fit Oxford Casual Shirt with Spread Collar & Full Sleeves,10,24,17,12,19,0,12,19,8,19,5
Liberty Men DTL-16 Formal Shoes,6,4,0,0,0,0,0,0,1,0,0
2 Double Racket with ONE Cover and Badminton NET,2,0,16,0,8,6,5,5,8,5,0
"Delzon 5 Liter Water Proof Ocean Pack Dry Bag for Travelling,Camping,Hiking, Rafting",0,0,0,3,9,13,0,4,8,13,0
BULLMER Mens Cotton Henley Neck/Chinese Collar Tshirt,7,5,10,15,4,5,0,7,5,8,0
Sukkhi Glimmery Gold Plated Choker Necklace Set for Women (NS104290),18,36,0,9,2,28,17,1,2,14,0
Jenna Eyelashes Dot Panda Sleeping Eye Mask White Free Size (Pack of 2),0,0,7,0,9,0,2,0,0,16,0
WildHorn Brown Leather Wallet for Men I Top Grain Leather I 8 Credit Card Slots I 2 Currency Compartments I 1 Coin Pocket ...,8,6,8,6,4,0,0,5,6,13,0
Backpack For Women's/Girls,0,0,5,0,0,0,0,0,1,7,0
Fossil Nate Analog Black Dial Men's Watch-JR1487,27,13,5,12,17,32,7,4,21,17,0
"Men's Earring non piercing Black, Silver Huggie Ear Studs Metal Jewelry for Boys Clip on Style",16,24,37,21,11,6,14,4,6,18,13
"RiaTech Wrist Rest Pad, Mouse Wrist Cushion Support for Office Upgrade Enlarge Memory Foam Set Keyboard for Computer, Lapt...",8,2,0,0,5,17,9,0,0,7,0
Sixfire® Cleaner 5 in 1 Keyboard & Earphone Cleaner Keyboard Cleaning Brush Laptop Cleaning Kit Cleaning Pen for Airpods C...,18,41,0,29,17,38,10,29,4,0,5
"Nine West Kylee Mini Tote Crossbody, Black 1, One Size",0,0,5,5,4,0,0,0,0,4,0
Fastrack Casual Analog Dial Watch for Men,10,2,0,0,0,3,0,7,3,7,4
Kuber Industries Plastic Multi-Purpose Large Size Compact Desk Storage Organizer Stationary Box for Case Pen Pencil Holde...,6,0,2,13,0,2,0,15,7,0,8
"Cosco Tuff Heavy Weight Ball, Pack of 6, Red, Youth Size",18,9,0,2,9,9,17,3,7,17,0
SmallRig Action Camera Case for DJI Action 2 Dual-Screen Combo Camera Cage with Magnetic Attachments Arm Your Action Camer...,7,4,8,7,0,4,0,29,3,4,6
PC Jeweller The Florescence 18KT Yellow Gold and Solitaire Ring for Women,0,0,0,0,8,0,16,6,0,5,3
EYEBOGLER Men's Striped Regular fit T-Shirt (T285HS_White Darknavy Indigo Royal S) EYEBOGLERMenRegularT-Shirt,25,31,6,19,6,11,17,14,11,0,2
Adidas Mens Lite Racer Rbn 2.0 Running Shoes,0,0,0,0,4,14,3,0,8,3,0
Kundan 24k (999.9) Lord Ganesh 8 gm Yellow Gold Bar,0,9,3,10,1,14,11,15,5,12,0
"Organic India Tulsi Green Tea Classic, 25 Infusion Bags (Pack of 2)",7,18,9,14,4,2,8,20,12,20,0
WORLD WEAR FOOTWEAR Kids & Boys (9314-1663-1666) Multicolor Casual Stylish Sports Shoes 2 UK (Set of 3 Pair),0,0,0,4,0,0,5,0,0,0,0
Dixcy Scott Maximus Men's Solid Regular (MAXV-003-GLIDE Vest-P2 White L),4,10,0,0,0,0,4,3,0,1,0
RedTape Men's Tan Sneakers-6,11,0,0,0,13,0,0,9,0,17,7
"Minimalist 8% L-Ascorbic Acid Lip Treatment Balm with Vitamin E, Radianskin & Glycerine for Pigmented & Dark Lips | 12 gm",0,0,11,4,4,0,5,0,9,0,0
Bourge Mens Reef-30 Running Shoes,8,0,3,0,4,0,13,11,0,0,0
Colorplus Medium Green Shirt,3,0,0,18,5,0,0,0,0,0,5
LANCER Mens Dragon-31 Sports Shoes,8,4,15,6,4,18,7,6,0,0,6
Cargo Jeans,12,6,1,3,6,4,6,4,6,0,5
Pramadda Pure Luxury Elegant mens sling bag small size for travel | crossbody chest bags for women | side bag for men styl...,5,0,22,0,6,3,12,3,12,6,17
Divine Magic Black Obsidian Yellow Jasper Healing Stone Gemstone Crystal Bracelet Jewellery for Women Men - Think in Black...,18,21,14,4,5,24,5,18,9,5,7
"Blue Star 1.5 Ton 5 Star Fixed Speed Window AC (Copper, Turbo Cool, Humidity Control, Fan Modes-Auto/High/Medium/Low, Hydr...",10,18,0,7,25,3,8,1,22,0,0
adidas Men's Pro Bounce 2019 Low Basketball Shoe,9,6,6,13,11,23,13,4,0,11,3
LMDLACHAMA 6.25 Ratti /5.50 Carat Natural Emerald Gemstone Gold Plated Adjustable Ring For Men And Women's,1,2,13,0,0,2,5,0,0,0,0
HSR Winter Warm Leggings Women Elastic Thermal Legging Pants Fleece Lined Thick Tights,8,11,10,0,22,0,7,0,11,19,0
Shining Jewel - By Shivansh 925 8 inches Silver Plated Imported Quality Cuban Bracelet for Men & Women (SJ_3059),6,0,4,3,7,6,0,10,11,0,0
"EMBOX Cube Extension Boards with USB Port with Universal Sockets and USB (2.4 A) Charging Ports (QC 3.0) with Indicator, ...",3,0,0,9,7,0,4,0,9,0,4
RAMRAJ COTTON Mens Traditional Half Sleeve White Shirt,0,0,0,0,0,0,5,7,5,0,0
"FZN Optical Glass Prism || Diy Reflection Prisms Equilateral Prism, 50 X 50 Mm || Pack of 4 ||",0,0,0,6,0,0,0,0,0,3,0
PLUMBURY® Women's/Girl's Cotton Lycra Cycling Shorts/Yoga Shorts/Night Shorts/Under Skirt Safety Shorts (Pack of 3) Black/...,7,15,17,6,25,20,10,8,3,4,0
"Wayona USB C to USB C 65W Short Powerbank fast charging cable compatible for Samsung Galaxy S22 S20FE 2022 S21 Ultra, S20/...",19,23,7,16,11,0,1,0,4,5,0
WoodenTant Women’s Cotton Silk Dhakai Jamdani Handloom Saree In Beige With Multicolor Thread Work without blouse piece,6,27,0,8,12,13,13,9,6,0,0
"KEBILSHOP DC Y Splitter Cable 1 Male to 2 Female,5.5mm x 2.1mm DC Power Extension Adapter Cable,for CCTV Surveillance Came...",0,19,15,19,14,14,10,10,2,9,7
"Godrej 1.5 Ton 3 Star 5-In-1 Convertible, Inverter Split AC (100% Copper,I-Sense, 2023 Model, AC 1.5T EI 18TINV3R32-GWA/AC...",26,5,18,14,22,15,0,5,8,9,0
Astonish Mould & Mildew Remover - 750 ml | Vegan & Cruelty-Free | Pack of 1,0,0,0,10,0,1,19,6,11,0,0
Lotus Temple City Diary,0,0,6,0,0,0,0,0,0,0,0
LUX Soft Glow|Buy 4 Get 1 Free|Jasmine & Vitamin E Bathing Soap|Velvet Glowing | Beauty Soaps| 150 g,7,0,0,6,7,0,7,6,4,8,0
American Eagle Men's Straight Jeans (WEA0116153911_Blue_38),3,7,18,11,6,5,12,16,0,0,2
Kuber Industries Disney Unisex School Bag|Kids School Bag|Mickey Mouse Printed|Lightweight School Bookbag for Kids|GREEN,14,8,7,4,16,4,4,10,0,5,0
"RAAYA Set Of Decorative 1 Comb, 1 Makeup Hand Mirror, Hair Padding Brush With Storage Box For Home And Saloon Use (40 g)",0,9,6,6,6,9,4,0,9,11,0
SG Musical - 1 Set of 4 Pcs Guitar String Guitar Accessories Bass Guitar Parts 4 Steel String Guitar Accessoriess - RR06,0,9,0,7,3,1,0,4,0,21,12
CreativiT Graphic Printed T-Shirt for Unisex Shiva Tshirt | Casual Half Sleeve Round Neck T-Shirt | 100% Cotton | D00489-20,0,21,1,5,2,11,7,5,0,11,6
Anuj Sales Emerald Stone Original 7.25 Ratti Natural Certified Loose Precious Panna Gemstone,6,7,0,6,23,7,0,10,7,15,0
"Bersache Casual Shoes for Men Walking, Sneakers,Loafers (Pack of 2) Combo(MM)-1217-1836",0,3,14,0,0,7,0,0,0,0,0
Sparx Newly Arrival Men's Shoe for Running/Gymming/Office/Walking/Casual/Outdoor Footwear.,13,10,4,12,4,6,3,0,0,4,0
Newd Printed Underwear Trunk for Men,3,18,6,12,11,4,2,0,9,18,13
Kuts n Crvs Leather Hide Skin for Crafting Accessories DIY - Nappa Black ( Garment Quality) (2.5-3.5 Sq.ft),0,11,0,6,3,6,0,4,1,0,0
SKYLARK INTERNATIONAL Double Bongo In Red Color with Spanner FREE Gig Bag,9,9,9,2,4,16,20,12,6,4,0
"Voltas 1.5 Ton, 5 Star, Inverter Split AC(Copper, 4-in-1 Adjustable Mode, Anti-dust Filter, 2023 Model, 185V DAZJ, White)",3,32,17,5,0,0,31,8,31,9,0
"URBAN PENDU India Jersey Fan - Customized Dryfit Polo Half Sleeves Mens Tshirt (White), Gift for Friend",3,7,8,7,25,4,11,0,17,3,3
Aspirer Mens Cotton Rich Striped Pocket Polo T-Shirt-Pack of 1,5,0,10,12,5,4,0,28,13,1,0
PrimeBox Helmet Cover Bike Riding Cotton Face Mask Anti-Dust Protection Neck Gaiter Outdoor Face shield Stylish Pack of 1 ...,15,15,9,2,3,5,0,14,0,17,8
MARKIF True Wireless Earbuds Bluetooth 5.0 Technology Headset with 48Hrs Total Playtime Touch Control Type-C Fast Charging...,7,6,8,4,0,0,0,0,4,0,0
Arrow Men Beige Geometric Print Dobby Formal Shirt (ARADOSH0757_42),0,5,0,4,7,0,0,0,0,10,0
LEYSIN Set Of 2 Pcs Kids Cute Fruit Shape Hand Pressure Mini Fan Toys Handheld Cool Summer Fan for Kids (Multi Color),4,0,0,6,0,4,7,13,0,6,4
QOZWEID® Mop and Broom Holder; Upgraded with Effective Strong Holding 5 Slot Position with 6 Hooks Garage Storage up to 11...,4,0,0,7,6,2,3,8,18,11,0
ZAPPER Silicone Back Cover for Samsung Galaxy S23 Case with Microfiber Protection Inside for Scratch Resistance (Black),0,5,7,11,21,0,25,11,0,3,4
"Amazinghind Leatherette Material Professional File Folders for Certificates, Files and folders for documents, Document Fol...",0,6,14,15,13,14,7,3,4,0,7
Royal Enfield Cotton Regular Fit Mens Casual Shirt (A20SHAW20010RE-P),0,0,2,0,14,2,0,0,3,0,3
umera clutches wristlet white china-moti for girls & women,0,0,0,0,6,0,11,0,0,0,0
QBM 12v DC Battery Charger Adapter UPS Battery Charger 14v DC 2 Ampere SMPS Battery Charger for Multiple Applications with...,0,0,0,0,8,0,3,0,0,0,0
Cantabil Men Regular Fit Solid Cotton Blue T-Shirt (MTSH00037-BLUE),2,0,6,7,5,3,4,0,6,0,7
BABYMOON Faux Fur Throw Basket Filler Blanket Baby Photography Photoshoot Props Flokati…,4,16,16,6,11,14,0,10,3,10,1
"Mee Mee Sipper Cup - Pink, 240 ML",7,15,0,12,0,0,10,0,20,4,4
Wrangler Men T-Shirt,14,11,24,20,0,16,3,19,2,12,13
"AmazonBasics laptopss Sleeve Case Cover 14.1-inches laptopsss for Men and Women | Slim Profile Neoprene, Soft Puffy Fabric...",17,0,0,5,0,0,0,0,0,7,0
MIRCHI FASHION Women's Stylish Chiffon Floral Printed Saree with Blouse Piece,4,6,0,5,7,10,10,3,0,0,0
REVLON ColorStay Look Book Eye Shadow Palette - Rocker (1S10330B01183006),10,6,0,0,0,0,8,0,0,0,0
2ROW Men's Canvas Red Loafers,10,13,15,22,8,10,18,15,6,18,0
RONZO Men's Business Genuine Leather Slip on Formal Shoes,5,0,8,11,14,9,6,9,5,6,0
"Sunbaby Bloom Stroller/Pram for New Born 0-3 Years,Extra Wide/Thick Cushion seat,2 Food Trays, Reversible Handle,Mosquito ...",8,0,5,0,0,0,9,0,0,7,1
"Senslife Women's Satin Solid Midi Short Nightdress (Sl014, Red, Free Size)",17,9,28,0,18,11,4,19,4,24,3
ALC Creation Women Kurta,0,0,0,2,0,14,7,0,0,0,0
Bourge Mens Moda-z1 Running Shoes,11,12,16,15,25,18,25,11,20,6,0
"Lux Lyra Ankle Length Leggings, Multiple colours - Dhanari Exclusive Offer",18,2,0,0,6,5,5,0,4,5,0
Free Authority Superman Blue Color Half Sleeves T-Shirt for Men,4,0,0,5,2,4,3,2,5,0,0
Puma Unisex-Adult Supertec Zero Running Shoe,0,3,0,0,6,6,0,2,10,0,0
In-Ear Headphone For Nokia 105 (2019) In- Ear Headphone | Earphones | Headphone| Handsfree | Headset | Calling Function | ...,7,14,10,4,0,5,5,24,21,10,2
Roland DP10 Damper Pedal,10,0,7,11,0,0,0,0,12,0,7
ID Mens Id1070 Driving Style Loafer,3,0,9,7,0,3,0,3,6,25,0
"BKN® Tranding Car Fragrance Air Freshener, Record Player with 1 Aromatherapy Blades, Aromatherapy Refill",17,6,8,16,29,16,5,13,19,9,9
Liberty Womens Agk-310 Loafer,0,0,7,7,23,10,0,0,6,1,0
"WATERTECH SYSTEMS Swimming Pool Water Purifier Dose Chlorine TCCA 90 granules TCCA90 Granular -(Pack of 25kgs box pack, Gr...",9,11,15,13,4,7,7,11,4,15,7
Lasmo Women Oversize Fit Round Neck with Short Sleeves Cotton Long Braid Girl Printed Crop Tops.,7,0,4,2,0,0,0,0,0,13,0
PC Jeweller The Elfie 18KT Yellow Gold and Diamond Ring for Women,0,0,0,0,0,0,3,0,0,0,0
BeeBasic Cotton Regular Fit Tshirts for Men Combo Pack of 2 - Round Neck Half Sleeves Tshirts,7,13,5,14,23,4,9,5,5,9,3
GR379RG Q BRO Vel GRE L_S,9,4,8,19,10,8,14,9,18,11,0
Ahilya Jewels 92.5 Sterling Silver Sardar Kada For Men's And Boys,21,6,13,17,12,14,11,19,8,18,2
TOM BURG Premium Stylish Luxury Trunks for Men,15,6,12,0,11,0,17,15,5,3,0
Sonata Analog Watch for Women - 8183NM02,2,0,0,16,7,0,0,5,4,3,0
"XAWONA Women's Net Design Lingerie Bra and Panty Set for Special Nights, Valentine's Day, Anniversaries, Honeymoon Gifts (...",12,3,0,0,6,3,0,0,5,6,0
BENGAL HANDLOOM Exclusive Women's Soft Dhakai Patta Jamdani Sarees,0,13,0,0,3,0,0,0,0,0,5
PC Jeweller 22k (916) Yellow Gold Ring for Women,5,0,4,18,10,19,15,4,4,5,0
Bhavika Pack of 3 IntelliSoft Solid Men Brief-NE-CZBRF3PCK5033,5,12,11,6,14,1,15,21,10,21,0
GadinFashion™ Pack of Red Rose Hair Band/Tiara Designed and Fabric Red Rose Flower Hair Clip | Hair Accessories for Girls/...,5,9,17,8,5,6,7,4,14,6,4
Mee Mee 2 in 1 Spout and Straw Sipper Cup | Anti-Spill Sippy Cup | BPA Free | Premium Plastic Sipper (Orange) -150 ml,25,39,9,12,9,16,0,21,0,3,0
Tiyona Analog Women's and Girls Watch (Set of 2),0,6,5,13,8,0,6,0,5,12,3
PC Jeweller The Lothar 22k (916) Yellow Gold Ring for Men,4,0,0,3,0,0,0,3,0,0,0
Microware 60M HDMI Extender Repeater Transmitter/Sender + Receiver Over Cat5 / Cat6 Upto 60 Meters (60M Extender Over Sing...,7,4,0,0,0,8,7,0,24,7,0
GoSriKi Men's Cotton Printed Boxer Shorts ( Pack of 2) (ANL-BXR-PACK-2-116-GS),0,0,0,23,0,0,0,9,4,11,9
Sahiba Gems 6.40 Carat / 2 Pcs Pink Color Heart Shape AAA Brilliant Cut American Zircon/CZ Jewelry Making Earring/Rings ~ ...,9,0,12,0,0,2,8,8,0,25,6
ABROS Men's Deccan ASSG1203 Sports Shoes/Casual Shoes/Running Shoes,0,5,0,0,6,7,5,3,4,7,0
Polycab Elanza Premium 1200 mm High Speed Ceiling Fan with 2 years warranty (Pearl White),11,2,4,4,16,0,17,3,0,4,0
FUR JADEN PU Leather 9 Slot Vertical Credit Debit Card Holder Money Wallet Zipper Coin Purse for Men Women (Tan),14,7,15,5,7,16,0,12,5,8,7
Trip Machine Company Leather Phone Pouch Tobacco,11,8,0,11,4,6,12,8,5,0,0
Red Chief Men's Rc3761 001 Sandals,15,11,8,7,5,12,0,21,16,3,1
"Caprigo Super Heavy Duty TV Wall Mount Bracket for 32 to 55 Inch LED/HD/Smart TV’s, Universal Fixed TV Wall Mount Stand (M...",0,0,0,0,0,5,0,0,8,0,0
Filora Women's Ethnic Rajasthani Silk Potli Bag (Multicolour) -Combo of 3,0,7,0,10,5,0,0,0,10,3,9
Vector X Target Cricket Shoes | White-Sky- Blue | Lace Up | Solid Sole | Size- 7 | Leather | for Adult and Men |,0,0,7,6,0,2,0,5,0,0,3
EIO Front Open Baby Jablas Pack 0f 4,6,0,7,0,0,0,0,0,8,10,0
Jaipurite Women's Rayon Printed Flared Anarkali Kurta in Blue,5,2,22,34,24,32,3,14,3,2,7
Zaveri Pearls Ethnic Jhumkis for Women (Golden) (ZPFK6396),2,8,13,13,9,15,0,16,2,3,9
Milan Jewellers rakhi for brother,14,4,0,0,16,6,5,0,15,5,0
"OPLU Men's Regular Fit Plain 100% Cotton V Neck Full Sleeves Casual, Trendy, Stylish Pootlu Tees and Tshirts.",0,14,1,0,28,0,5,5,9,16,9
"Flingr Poly Spandex Women's Sports Shorts For Slim Fit | Sport Shorts For Workout, Yoga, Exercise, Running, Cycling, Gym C...",34,4,36,17,1,14,32,7,14,11,3
LKDS Slim Body USB HD 4K Spy Pen Camera Hidden Pen Camera with HD Video and Audio Recording with Voice Recorder with 16 GB...,0,0,0,0,0,0,0,0,3,0,13
SERENE TOUCH Women Silicone Breast Lift Rabbit tape Nipple Covers Pasties Invisible Adhesive Strapless Backless Reusable L...,6,7,16,6,10,7,8,0,11,20,0
Hush Puppies Men's Franklin Leather Loafers and Moccasins,4,10,13,11,4,9,0,0,0,4,0
CreativiT Graphic Printed T-Shirt for Unisex France_Country_Travel Tshirt | Casual Half Sleeve Round Neck T-Shirt | 100% C...,0,6,8,0,12,2,11,7,12,14,0
"Bell BLHP105 Wired on-Ear Headphone with Tangle Free Cable+3.5mm Jack, Headset with 18hz-24Khz Frequency Response & 32ohm ...",3,0,15,19,6,5,3,8,10,5,4
Fostelo Handbag For Women And Girls | Ladies Purse Faux Leather Satchel Bag | Woman Gifts | Wedding Gifts For Women | Wome...,14,0,3,11,4,13,20,7,2,26,5
AQUAULTRA Dolphin 5 stage Purification 9 Liter RO + Active copper + Activated Carbon technology Water Purifier Filter For ...,2,6,18,13,5,4,4,14,1,10,3
Inditrust Chainsaw Chain For 16 Inch Chain Saw Bar Pitch 3/8 Inch Gauge 0.05 Inch 59 Drive Rod For Electric Saw,8,0,21,10,1,4,0,6,6,0,0
Gadgetsden Belly Button Navel Piercing Ring Silver Color Heraldic Design Flower Opal Cubic Zirconia's Body Jewelry Barbells,3,21,17,0,6,0,4,10,0,6,0
Fuqimanman2020 Unisex-Adult Dainty Tai Chi Hand Woven Adjustable Cord Matching Yin Yang Bracelet Set - 2 Pieces,6,2,6,2,0,0,0,1,8,10,0
R.O. DIVERTER BALL VALVE,0,0,8,3,6,13,6,13,16,7,0
"Digitek DUC006 Charger with LPE17 Lithium-ion Rechargeable Battery Pack for DSLR Camera, Compatibility - EOS 750D, EOS 760...",0,5,7,0,6,11,0,4,0,14,5
QONETIC Electronic Kitchen Digital Weighing Scale Multipurpose 10 Kg (SF-400A),16,10,4,0,0,0,7,12,10,6,0
"Luminous Power Sine 800 Pure Sine Wave 700VA/12V Inverter for Home, Office, and Shops",0,0,7,0,0,5,0,0,0,0,0
BIBA Women's Cotton a-line Suit Set,5,19,5,12,0,7,14,20,14,7,0
Pujia Mills women's embroidery handwork thread zari stone work readymade blouse,0,9,4,6,19,4,10,0,18,6,7
SMARTCAM® 360° Fisheye Wireless Panoramic WiFi Camera 3MP HD Home Security IP Camera Lighting Night Vision Two Audio Bulb ...,0,0,0,11,6,11,1,3,3,0,0
Fancy Lifestyle Girls Silk Anarkali suit (mohini 63001_Red_XL),0,0,4,5,0,0,2,0,0,0,0
Baby Moo Cute Puppy Checked Chu-Chu Sound Breathable Anti-Skid Sandals - Multicolour (3Y-3.5Y),9,0,6,0,21,22,0,1,21,0,7
Allen Solly Men Shirt,14,0,15,6,19,13,0,0,0,0,6
Walktrendy Women's Ballet Flat (wtwb557_Cream_41),7,10,21,12,7,39,6,0,12,0,0
Jack & Jones Regular Fit Vest,5,0,0,18,5,6,7,15,12,13,12
Anayara Women's Rayon Casual Long Printed Top,0,19,5,17,17,5,2,8,6,9,0
"RILO Women's Printed Hosiery Cotton Full Sleeve Nighty/Nightgown/Maxi (Orange, Size - 3XL) FSX-025",0,4,7,0,0,5,19,8,2,7,0
GoSriKi Men's Cotton Printed Boxer Shorts ( Pack of 4) (ANL-BXR-PACK-4-GS-015),0,6,2,0,2,4,0,5,12,0,4
ROMOFY PU Synthetic Leather Classic Trendy Top Handle Handheld Shoulder Daytrip Crossbody Women Slingbag,15,0,0,0,0,0,0,0,0,7,0
Sparx Mens Sm-789 Sneaker,15,32,25,2,22,4,32,12,23,12,4
Aakrutii Reusable 100% Cotton EcoFriendly Water Bottle Carry Bags | Wine Holder Bag | Gift Bag (Cream) Pack of 2,0,1,0,2,8,0,9,1,0,9,0
Nike Men's Revolution 5 Running Shoes 12 US,0,4,39,0,5,2,0,4,0,0,0
AADI Men's Mesh Outdoor Casual Shoes - MRJ1939/40/42/44/45,2,6,0,0,0,0,0,0,7,0,0
Lucky Brand Women's Microfiber Hipster Panties Multi-Pack,8,5,0,1,4,0,0,12,3,0,0
"Kytsch Metal Chain Best GITS for Husband and Wife Analog Wrist Watches for Couple Gifts for Wedding (Gold Dial, Gold Color...",0,0,0,0,6,5,2,14,7,0,0
Aurelia Women's Rayon Regular Kurta,6,6,0,0,0,4,3,0,0,12,0
BIBA Women's Cotton Salwar Kurta with Dupatta,0,5,0,8,0,11,7,41,9,12,11
Hidesign,0,9,8,0,3,3,0,0,0,0,0
The Souled Store The Lion King: Simba Pattern Womens and Girls Graphic Printed Cotton Women's Shirts White,13,0,16,0,6,6,9,4,0,10,0
Levi's Men's Slim Fit Casual Shirt,0,8,0,19,16,5,7,5,9,8,0
Avsar Jewellery 14k (585) Rose Gold Ring for Women,0,8,0,3,12,0,7,0,0,5,0
TheGiftKart Flip Back Cover Case for Samsung Galaxy M33 5G | Dual-Color Leather Finish | Inbuilt Stand & Pockets | Wallet ...,4,7,5,6,0,6,10,2,5,22,0
