MITHILA HANDICRAFTS One Face Rudraksha | Ek Mukhi Rudraksha | Natural | Lab Certified in OM Shaped Panch-Dhatu Pendant |,15,12,15,12,7,6,0,22,3,7,13
Metro Men Leather Flat Shoes (19-5547),0,0,0,0,0,0,9,3,5,0,7
Classic Polo Mens Cotton Blend Half Sleeve Striped Regular Fit Polo Neck T-Shirt,6,0,3,7,0,0,0,4,4,0,7
Emeret Anti Skid Four Wheel Balance AB Roller Portable Exerciser with Knee Mat for Abdominal Stomach Total Body Workout Hi...,5,0,5,4,0,1,0,0,1,0,3
"ESR Boost Kickstand Case for Samsung Galaxy S23 Ultra Case, 3 Stand Modes, Military-Grade Drop Protection, Supports Wirele...",0,4,7,0,1,7,0,0,4,3,0
Elevea { Today HOT Deal with 12 Years Guarantee } USB Wireless Bluetooth 4.0 Transmitter Stereo Audio Music Adapter for T...,0,0,0,5,0,0,0,4,22,2,0
Kuber Industries Parachute Big Underbed Moisture Proof Rectangular Storage Bag with Zipper Closure and Handle (Black),15,0,0,7,1,15,6,3,0,0,0
"Bewakoof Women's Printed 100% Cotton T-Shirt - Boyfriend Fit, Round Neck, Half Sleeves",0,4,5,9,19,12,18,2,13,0,9
DEVICE OF URBAN INFOTECH 20-60 X 60 Spotting Scope High Powered Long Distance Galaxy Telescope with Tripod Stand & Smartph...,13,15,0,8,8,17,2,9,14,5,0
Jockey Women's Regular Fit Vest Top,5,0,0,5,3,0,0,0,10,0,0
Lyrovo Car Vacuum Cleaner Double Filter 5000mAh 5Kpa Mini Cordless Rechargeable (Use Time ? 15 min) (Black) (6 Month Warra...,9,0,0,0,0,7,0,0,4,0,0
Thuban Fashion Women Printed Long Sleeve Slim Fit Crop Top/Blouse V Neck Maroon & Black,2,0,7,11,3,6,25,19,4,0,0
Reebok Mens Grey Mesh Work Shoes Alloy Toe Oxfords 7 M,11,3,0,12,6,13,11,20,12,3,3
2K ohm Variable Resistor-Preset – 2 pieces pack,3,1,5,0,2,4,3,0,0,4,0
Ananth Jewels BIS Hallmarked Silver BAR 10 grams Congratulations,7,10,26,21,12,23,19,15,12,22,7
Meotion Power Sharing Cable 1 m USB Cable for Mantra mfs100 Replacement fingerprint scanner biometric cable,0,5,0,0,5,0,10,6,0,0,0
"Goatter Unisex Hunter Leather Multi Pocket Messenger Bag (Coffee Brown, 11 Inch, GTHT-07)",25,34,4,8,13,2,16,24,11,7,1
Tommy Hilfiger Ariel Women Leather Flap Wallet Navy,4,0,12,7,9,7,7,0,7,5,3
Vaamsi Crepe Digital Printed Kurti(VPK1619_Black),8,19,31,6,26,0,8,8,28,0,0
Chappal Mens Leather Handmade Formal Shoes - Tan Brown_{ch8},0,17,1,0,0,3,13,8,24,13,6
"Davidoff Rich Aroma Coffee Bottle, 6 x 100 g",0,0,0,4,0,10,0,0,0,2,0
ORGANIC CLEANSE Women Slim Fit Solid Cotton Casual/Formal Shirts for Women Office Wear,14,6,14,3,31,7,14,20,16,12,15
AnjuShree Choice Women's Regular Short Kurti,49,0,15,17,14,2,0,10,0,0,0
myfriday women Small Crossbody Sling Bag Hand Clutch Shoulder Bags Cell Phone Holder Card Pocket Wallet Purse for Girls,6,15,17,8,0,7,7,15,12,14,0
SYGA Women's PVC PLastic Belt Alloy Buckle Ladies Grommet Clear Waist Belts for Jeans Transparent Belts Pin Buckle,9,3,10,15,21,19,12,27,0,31,6
"Mattlook Perfect Brow Duo-Shade Brow Powder, Eyebrow Palette With Smudger Brush, Eye Makeup, Multicolor-3 (8gm)",7,11,6,6,12,12,13,5,3,0,0
Avsar 14k (585) Yellow Gold Ring for Women,0,0,0,10,0,0,17,4,0,9,0
THAPKI Women's Printed Rayon Anarkali Kurta with Dupatta Set,8,0,2,5,22,0,0,11,11,6,0
Pujia Mills Women's Floral Printed Georgett Puffy Sleeve Round Neck Line White Blouse (Moksha White),10,0,37,5,3,0,0,5,10,0,3
Wrangler Men Brown OD Solid Regular FiT-Shirt,3,8,4,0,0,6,7,6,5,0,0
"adidas The Road Cycling Shoes Men's, Blue, Size 7",0,5,0,0,6,0,0,0,6,3,0
AVSAR 18k (750) White Gold and Diamond Bangle for Women,0,12,8,6,0,6,0,7,13,7,0
"Kuber Industries Cotton 2 Piece Full Hand Arm Sleeves Gloves Set - White, Standard",0,3,0,15,0,2,3,5,9,0,0
INDISSH Unisex Regular Fit Music Graphic Printed T-Shirt|(THB-01)|,11,0,8,8,0,12,0,9,15,18,0
Rupa Men's Solid Regular Vest (RFLHKFHUNKV2PX095 and Print May Vary 95 CM),5,4,0,0,5,5,3,0,0,4,0
Trokopoka Metal Vintage Bottle Opener (Pack of 3),11,0,4,0,20,0,8,10,5,0,6
Baggit Women's 2 Fold Wallet - Large (Mustard),21,18,0,4,7,7,1,0,11,9,5
Jara Collection Women's Net Solid Knee Length Babydoll Lingerie With G- String (RIOE-BD-XL401 Pink_Pink_Free Size),0,0,13,8,0,8,6,0,0,0,0
Hitage in-Ear Extra Bass Headphones Lossless Nosie Reduction Earphone Wired Headset with Mic for All Smartphones & iOS Dev...,0,5,11,6,6,6,0,15,6,12,0
"WMX Women Compression T-Shirt Top Plain Athletic Fit Multi Sports Cycling, Cricket, Football, Badminton, Gym",2,0,3,0,0,9,6,0,2,6,0
Piestar BTS Black Cotton Hooded Hoodie for Girls / Boys / Kids,5,11,0,0,13,6,15,8,19,25,0
KLOSIA Women Solid Kurta and Pant Set with Silk Dupatta,26,22,0,4,5,14,18,0,6,14,0
3NH® Polarized Clip On Sun Glassess Lens Sun Glassess -Parent : Dark Green | 11420,7,4,5,11,16,14,0,0,7,12,3
ABC Sexy Pouch Briefs Multi Color L Size,3,12,2,22,2,14,16,12,0,0,0
"Veena@Mota Nada Dori Strings Cotton Thread 10 Meters 100% Pure Cotton Strings for Ethnic Indian Dresses, Pajama, Lehenga, ...",0,0,7,0,0,0,0,5,7,7,0
Digital Trail Camera 12MP & Trail Camera Motion Activated Night Vision Waterproof 46pcs IR Lights for Outdoor Wild Home Se...,8,6,10,8,0,1,6,10,9,6,0
"TYPE-C Earphone for OnePlus 9 , OnePlus9 , OnePlus Nine in Ear Type C Wired Earphones with Mic, Braided 1.2 Metre Cable, M...",7,0,8,0,0,12,4,11,21,5,6
Sullery LES Bernard 'A' Alphabet Letter Pendant Silver Stainless Steel Necklace Chain for Men and Women,16,23,6,0,29,13,8,9,14,11,3
D D FASHION Gold plated Double Nail pandent with chains for Mens.,15,15,0,18,8,3,0,21,0,4,0
NXXTTNK HD Panoramic Fisheye Security Wireless IP Camera - 360° Wide Viewing Angle with Remote View - v380 Security Camera,4,0,0,0,0,0,0,0,0,0,0
"Suruthi Premium Adjustable Multi-colour Camisole / Slips (Pack of 5) (90 cm, WHITE, SKIN, PINK, ROYAL BLUE, DARK PINK)",16,12,3,0,1,8,27,0,5,14,9
Studio Shringaar Beaded Eyeglass Sunglass Spectacle Cord Neck Strap String Chain Link Holder 74 cms,0,6,5,10,0,0,0,6,18,6,10
WiseLife Printed Yoga mat for Men and Women + Sleek Yoga Strap + Yoga Mat Storage Bag. TPE Material 6mm Extra Thick Extra ...,0,0,4,5,6,3,4,0,0,0,0
"Flexnest Flexdubs True Wireless in Ear Earbuds with 40dB ANC Active Noise Cancellation, 35 Hour Playback, 4-Mic Design, A...",17,0,0,6,12,9,7,0,4,1,0
Moneekar Jewels Stainless Steel and Ring for Men,25,12,6,10,2,0,4,12,11,0,0
IndiWeaves� Fleece Solid Side Striped Lower for Women [Pack of 3],5,4,15,7,0,7,0,0,5,3,4
Louis Stitch Men's Style Brunette Brown Derby Shoes Handmade Formal Italian Leather Shoes for Men (Czech EUBGSU),29,10,13,3,13,10,7,41,33,13,0
GENERIC GUJARAT Titans 2022 IPL Jersey Half Sleeves,0,0,0,9,2,0,7,0,0,6,0
Fresh Vibes Meenakari Fancy Silver Payal for Women - Traditional Design Daily Use Pajeb Payel Anklets for Ladies - Sound M...,0,1,6,14,5,0,6,8,12,0,0
AFJ GOLD Copper Gold Plated Bangle Set For Women & Girls,12,7,0,5,10,0,5,14,7,0,10
"HEYCANDY Baby Bath Chu Chu Colorful Animal Shape Toy (Multicolor, Multi Design) - Set of 12 Pieces",10,9,0,5,14,6,0,11,0,9,4
"SHASHIKIRAN Kitties Cartoon Animated Pink Earphone for Kids with 3-Extra Earbuds, Multi (3D Cartoon Animated Earphone)",0,9,0,7,0,6,5,18,8,18,0
"Mishrit Wireless Gadgets Dummy CCTV Camera with Light for Home, Shop (Multicolour, 1)",0,6,1,7,8,7,0,7,4,0,0
PC Jeweller The Ellyce 18KT Yellow Gold and Diamond Ring for Women,11,13,4,2,9,4,0,9,0,0,0
Axter Multicolor Men's Casual Sports Running Shoes 8 UK (Set of 2 Pair) (2)-9278-5014,0,0,0,0,0,5,0,0,0,0,0
"Schsteindar® EN-EL14 Rechargeable Pack Compatible with Nikon Digital Cameras|D3100,D3200,D3300,D3400,D3500,D5100,D5200,D53...",5,0,12,9,0,0,4,0,5,8,7
GIANTE Storage Bags Women Small Organizer Dustproof Polyester Reusable Buckle Red (66031257GI),0,3,5,6,0,0,0,0,9,0,0
"GenX Mens Jazz Printed Outer Elastic Modern Drawer, (Pack of 4)(Colors and Prints May Vary) Multicolour",8,8,10,23,6,13,24,25,7,15,0
BROWN BEAR Design Germany Vintage Ladies Purse,13,4,26,6,6,7,11,11,18,14,0
Centrino Mens 8671-3 Men's Formal Shoe,3,18,0,0,2,0,0,3,0,0,0
Anbee Osmo Action Camera Protective Cage Vlogging Accessory Frame Housing Case Shell with 2 Cold Shoe Mount for DJI Osmo A...,0,5,1,0,9,9,0,7,9,11,0
"Monsoon Harvest Crunchy granola Bars Cranberry & Orange, 40 g",0,0,0,4,10,0,0,0,0,0,0
Puma Men's Streetballer Mid Geo Dp Boot,0,0,0,0,5,0,0,0,0,0,0
Passion Petals Apple Kids Girls Sling Bag Cute Silicone Girls Sling Bag Girls Coin Pouch For Age 2-8 Years,10,10,21,2,20,13,13,18,15,6,0
Orient Electric Kratos DIKR10IH 1000-Watt Heavy Dry Iron (Ivory),8,0,8,11,11,17,13,12,0,16,6
Denali Horizontal Plain Sling Bag,0,4,0,4,0,0,0,8,0,0,0
"Merries Newborn Size Taped Diapers for kids , 24 Count (New Born - 24)",0,0,0,6,6,7,0,0,0,0,0
Avsar Real Gold 14K RING AVR413YB,15,13,4,6,17,5,3,22,6,26,0
Rock Paper Scissors Premium Seamless Non-Padded Slip On Sports Bra Cross Back Bra Low Impact Workout Black Bras Activewear...,0,9,0,9,0,8,15,3,6,4,0
"Lyle Micro Fiber Mesh/Top Mesh compatible with Prestige Tattva, Stainless steel and 2.0 Model Gravity Water Purifier",5,0,0,3,0,7,0,0,2,0,0
SPYTECTIFY Secret Switch Board Socket Camera Hidden Audio Video Recorder 24*7 Continuous with Day Vision (V380 Pro APP),5,10,20,6,10,29,5,0,7,21,0
Puma Unisex-Adult Pacer Future Color Utility Sneaker,12,15,0,6,8,9,14,16,0,7,1
SanDisk SDCZ430-032G-I35 Ultra Fit 3.1 32GB USB Flash Drive (Black),0,0,0,0,0,0,0,0,7,0,0
COTTON BREEZE Women's Midi Skirt (FP570_Black_Free Size),5,2,3,8,0,11,0,6,0,0,0
"JUNEBERRY® Black Tshirt for Women, Official Disney Donald Duck Printed Half Sleeves Plain Black Tshirt for Women, Cotton T...",4,8,4,14,21,15,21,13,8,22,1
Genie Flamenco2 Casual Backpacks for Women,10,13,2,18,10,19,7,9,8,17,2
Caprese Women's Handbag,5,15,0,9,8,8,0,0,28,23,0
"REHTRAD 8 In 1 Set Pearl Hair Clips for Women, Hair Clips for Women Stylish, Lovely Clips for Hair for Girls (Type 6)",0,6,0,0,0,9,0,4,10,7,2
Max Women Women Solid Beaded Dupatta (NOOSNYD21ROROSE PINK_FS),0,0,12,0,5,18,7,25,36,0,6
"Mincerfit 5 Pairs Nipple Covers for Women Cotton, Skin Friendly Adhesive, Disposable Invisible Nipple Stickers.",11,0,7,0,0,10,6,14,1,7,0
Majestic Man Slim Fit Cotton Casual Check Shirt for Men,1,0,0,5,8,14,3,0,6,11,0
Lancer Mens Active-114 Platform,3,18,0,32,0,11,3,8,7,13,7
Blissta Women's Sky Organza Floral Printed Saree With Unstitched Blouse,3,6,7,0,7,0,0,0,7,0,0
"Racold Andris Uno 15 Litres Vertical 4 Star Storage Water Heater (Geyser), White Body Black Panel, with Free Standard Inst...",8,0,6,6,0,0,0,0,8,13,0
NEUTRON Quartz Analog White and Black Color Dial Women Watch - GC20-(75-L-10) (Pack of 2),0,0,0,16,6,0,0,0,0,0,0
Three Shades Mens Bracelet Brass Gold Plated Link Chain Bracelet for Men,4,0,7,5,0,0,4,0,4,8,6
"Kuber Industries Parachute 2 Pieces Jumbo Attachi Bag Travel Handbag Storage Carrying Bag, Blanket Cover, Duffle, Travel M...",0,14,11,0,12,13,13,9,4,8,6
"Rishabh Enterprises Hub Cricket Bat with Ball for Boys, Girls (Size No. 6)",6,8,0,13,0,13,12,7,5,0,0
Malabar Gold and Diamonds 950 Platinum Platinum Ring for Women,0,0,6,10,0,9,0,0,8,2,0
BEZELO Analogue Women's Watch(Silver Dial Gold Colored Strap)-BZL-LC-T-17223-B-2TT,5,16,25,4,12,0,8,10,18,21,6
Sparx Mens Sd0734g Sneaker,13,4,0,11,6,9,4,21,0,3,5
Jorden Grey Colour Shoes for Men,0,20,0,9,12,11,4,4,0,10,0
Infinity World Casual Heel sandals for girls and women,0,0,0,7,4,0,5,0,0,0,0
HiREL'S Men's Outdoor Biker/Trekking Boots with Zip,12,4,2,8,6,2,9,3,14,6,3
KAYU™ Boys Snowfall Solid Regular Fit Full Sleeves T-Shirts {Pack of 1},14,6,14,5,3,9,11,19,0,3,1
wear your mind Men's Regular Fit Vest,0,0,0,0,4,0,3,0,10,0,0
Nike Mens Air Max Sc Running Shoe,0,11,0,4,4,10,0,7,9,7,0
JBL Partybox 110 | Wireless Bluetooth Party Speaker | 160W Monstrous Pro Sound | Dynamic Light Show | Upto 12Hrs Playtime...,11,31,9,42,38,30,11,11,4,17,5
Wellon Triwin TFC 80 GPD Blue Membrane Suitable for All Types of RO Water Purifier Blue.- 1 pcs,4,17,30,11,5,16,0,4,0,12,4
"theBalm Meet Matte Hughes Long Lasting Liquid Lipstick, Doting, 7.4ml",3,10,0,7,0,0,0,2,0,0,0
Advick Men's Chery Slip-On Wedding Shiny Stylish Formal Shoes,0,0,0,0,3,4,0,5,4,0,2
KILLER Men's Regular Track Pants,7,9,8,4,10,0,3,19,6,49,0
315 Rifle Full Chain Matty Gun Cover,0,7,1,0,9,3,0,0,3,16,0
SONA Gudnini Womens Trendy Nice Printed T-Shirt Pyjama Set GN-TPS-0054,0,1,4,13,0,0,0,0,0,6,0
Walkaroo Mens Wf6005 Moccasin,11,20,22,0,8,36,0,6,4,5,0
Kakss Neoprene Dumbbells sets for Gym Exercise (Proudly Made in India) (0.5+0.5=1 kg Pink),0,0,0,0,0,0,5,1,0,0,0
"Associated Uniforms Designer Half sleeve Chef Coat (Chef Jacket - Smart Fit) (XL-42, WHITE/BLUE)",5,0,0,6,0,9,1,9,6,0,0
ASICS Unisex-Adult Ds Light Wd 3 Football Boots,0,0,10,11,0,0,0,4,0,0,7
"Skillmatics Outdoor Game - Strike 7, Strategic Game of Knocking Down & Building Up, Family Friendly Game for Ages 6 and Up",0,12,8,13,22,6,0,0,18,9,5
M Men Style Biker Jewellery Religious Christan Christ Jesus Cross With Round Box Chain 24 Inch Black And Silver Metal Pend...,0,5,8,0,12,7,5,0,5,6,0
Shences Genuine Leather Boots for Men,16,13,0,0,10,11,6,11,0,23,5
Zebra Analogue White Dial Girl's Watch for Women (Pack of 1) (Black),0,5,3,11,8,23,3,12,15,10,2
Sonata Onyx Analog Black Dial Women's Watch-NN8164NM02/NP8164NM02,2,6,14,4,3,7,0,4,6,13,0
UrbanMark Women Round Neck Floral Printed Peplum Top with Bell Sleeves-Black,0,7,3,10,0,13,11,0,0,3,0
PC Jeweller 18k (750) Rose Gold and Diamond Ring for Women,0,10,5,6,3,7,4,10,1,0,0
Amazon Brand - Symbol Women Work Utility Pants,0,6,0,1,17,8,0,0,3,10,0
"Philips Avent Classic Soft Spout Cup, 200ml (Pink/Purple)(Pack of 2) (6-9 Months)",30,6,6,9,11,16,7,7,8,15,15
BUFFALO Men's Slim Jeans,0,0,0,0,8,3,0,0,1,0,0
"Foxsky 7.6 kg Semi-Automatic Top Loading Washing Machine (FOXSKY AQUA WASH 7.6 KG, MAROON)",0,7,7,9,3,10,2,2,7,8,0
"AkDream's latest Stylish Pu-leather Trendy Cute backpack for collage, School Girls , women and ladies Small 5L(Black)",15,6,7,0,6,0,8,0,1,7,0
WORLD WEAR FOOTWEAR Men's (Combo-(2AMZ)-9393-9310) Multicolor Sport Sneakers Running Shoes 9 UK,0,0,13,0,0,1,0,2,5,0,1
Klepe Boys F18 Running Shoes,0,5,0,0,0,0,2,0,0,0,0
Crazyify Beaded Star Watch Charm Set of 5 Adjustable Wrist Watch Charm for Women & Girls Jewellery for Gift,0,0,8,0,0,8,5,0,0,16,0
"TWEAK Instant Coffee PREMIX,320 g (20 Sachet x 16g)",5,7,3,0,0,2,2,3,0,0,0
SINI MINI Sinimini Plain Full Sleeve Girls top (Pack of 2),0,3,5,7,0,0,6,0,14,6,0
"Herbalife Afresh Energy Drink (Lemon, Ginger, Elaichi, Cinnamon and Peach Flavour) Pack of 5 (50 g Each)",7,29,29,24,11,13,14,40,14,7,10
Car Craft Car Horn Compatible With Bmw Mercedes Audi Jaguar Porsch Bantley Land Rover Volkwagen Skoda Honda Volvo Toyota M...,20,12,12,6,15,9,26,2,18,3,0
"Daikin 2.02 Ton 4 Star Inverter Split AC (Copper, PM 2.5 Filter, 2021 Model, FTKL71UV, White)",5,24,8,12,2,17,5,18,5,0,8
Jack & Jones Men's Regular Fit T-Shirt,5,0,0,9,0,6,18,3,12,26,8
Tarshika Womens Printed Crepe Stitched Kurta & Patiyala Set with Dupatta,3,0,14,4,0,16,13,0,2,14,3
Fastrack Analog Black Dial Women's Watch-6152NM01,6,1,18,5,7,19,6,11,14,17,0
Canvas Tote Bag for Women | Stylish canvas shoulder shopping bag | cotton canvas bag | women's bag | stylish bag for girls...,0,0,0,0,0,0,0,0,11,0,0
"Relish Birthday Gift for Girls, Analogue Watch & Birthday Princess Printed Ceramic Coffee Mug & Birthday Girl Sash | Gift ...",0,12,0,4,0,6,12,0,3,13,0
Campus Men's Veron Running Shoes,0,0,12,17,8,0,7,4,7,0,7
Aimil Neeri Kft Ayurvedic Sugar Free Syrup - 200Ml,0,0,0,0,0,3,6,6,11,4,0
J10 1505 Mens Casual Office Corporate Evening Dress Oxford Laser Punch Shoes for Men in Colour Black|Brown|Tan|Cherry,7,3,14,0,9,28,5,0,11,25,7
"Bewakoof Men's Never Mind Stripe Typography 100% Cotton T-Shirt- Oversized Fit, Round Neck, Long Sleeve",0,7,25,2,3,5,2,0,5,6,0
Adidas Men Running Shoes,2,0,7,4,0,4,0,0,5,0,7
"PRIT Enterprise Women & Girl Latest Trendy Wedding Event, Evening Party Hand carry Purse Bride Party Clutch Bag(Pack of 1)...",7,6,5,4,6,5,8,2,5,4,6
Harmeet Men's Sport Shoe Ultralight Colorblock Trending and Stylish Comfortable Shoes with AIRMIX Sole for Sport/Gym/Casua...,14,4,7,8,13,0,7,17,8,19,7
GLASS EMPIRE METAL BANGLES VELVET SET FOR WOMEN & GIRLS (PACK OF 42),6,7,5,7,12,0,0,9,4,0,0
SK RAYANElectric 1.5 L Multiifunction Mini Cooker Kettle with Glass Lid Base Concealed Base Multi-Purpose Cooking Pot Nood...,0,0,5,6,0,0,5,0,0,0,0
"QZ USB 3.1 Type C Hub, USB C Hub, USB Type C to Ethernet Adapter, Type C to LAN RJ45, USB C to Ethernet Adapter [Thunderbo...",10,8,8,0,10,14,6,15,13,9,6
"iBELL PEK20BL Premium Electric Kettle, 2 Litre, Stainless Steel with Covering,1500W, Auto Cut-Off Feature, 360 degree Rota...",5,5,4,4,6,21,8,5,4,7,11
Neewer 200mm Professional Rail Nodal Slide Metal Quick Release Clamp for Camera with Arca Swiss Compatible,1,0,3,0,16,8,7,8,12,0,0
ZAVERI PEARLS Blue Crystal Shine Stones Party Bling Contemporary Bracelet For Women-ZPFK10328,9,2,6,0,7,0,5,0,0,0,0
Boltove® 6 Ft. x 9 Ft. Portable T-Shape Background Backdrop Support Stand Kit with 4 Backdrop Clips and Carrying Bag for G...,8,6,7,15,15,14,5,1,0,39,2
Amante Print Low Rise Three-Fourth Coverage Hipster Panties (Pack of 3),24,32,30,12,16,10,23,10,9,15,0
WorldCare® 5mm Neoprene Anti-skid Scuba Diving Surfing Swim Wetsuit Boots US Size 7 (66003287JEL),13,11,7,7,7,4,5,5,15,0,0
"Signoraware Executive Round Big Plastic Container Set, 450ml, Set of 4, Deep Violet",5,10,8,9,12,3,6,0,21,1,8
GoSriKi Men's Cotton Printed Boxer Shorts ( Pack of 4) (ANL-BXR-PACK-4-GS-070),22,0,17,4,5,0,5,14,3,0,0
Hohner 560PBX-C Harmonica Special 20 Key of C Blister Pack,0,5,0,0,0,16,0,14,2,0,0
WALLETIN Black Artificial/PU Leather Wallet for Men - 02 Currency Compartments 02 Hidden Pocket 01 Coin Pocket 03 Credit C...,5,0,8,3,0,5,13,0,0,0,0
Monte Carlo Men's Regular Casual Pants,0,12,0,0,0,0,8,0,0,0,0
Miss Jo 92.5 Sterling Silver | A Forever Heart Shaped Pendant set with Brilliant Cut Cubic Zirconia Stones set in Sterling...,11,19,0,10,10,1,7,7,11,19,0
KARCHER Wd 3 V-17/4/20 |17 litres Capacity|Blower Function|4 M Cable with 2 M Suction Hose| Efficient Cleaning Wet and Dry...,0,8,17,31,6,15,9,0,7,10,12
Trendy Women's Cotton Designer Modern Anarkali Maxi Dresses Blue,28,12,18,8,10,19,11,7,8,10,0
PC Jeweller The Berlyn 22k (916) yellow-gold Ring for Women,0,0,0,0,2,0,9,0,7,12,0
Riyen Genuine Leather Men (Tan),0,0,4,0,0,0,0,5,0,0,0
Clovia Women's Polyamide Padded Wire Free Full Coverage Bra,0,2,0,0,11,19,7,0,2,0,0
ZEYO Women's Cotton Heart Printed Stylish Night Suit Set of Top & Shorts 5604,5,9,0,11,29,3,8,11,26,7,17
Hitarth Fashion Women's Georgette Embroidery Sleeveless Blouse,0,6,0,0,0,0,0,15,6,0,0
Baggit Women's Tote Handbag - L1-LAPTOP (Purple),0,7,5,21,7,11,3,0,5,8,6
MESH MASTERS Air Cooler Plain Grass_Cooling Pads_Wood Wool_18 x 26 Inches_Set Of 3 Pack_Suitable For All Desert Coolers MM...,9,0,0,0,0,0,0,0,5,0,0
Red Chief Formal Shoes for Men RC3501,0,2,3,0,0,0,0,0,0,0,0
Edifier R501BT 93 Watt 5.1 Channel Wireless Bluetooth Satellite Speaker (Black),0,0,0,3,5,0,0,0,0,7,0
Max Women's Printed Round Neck Straight Kurta,13,0,24,17,10,16,12,15,14,37,0
Bourge Mens Loire-z54 Running Shoes,16,0,9,0,2,8,0,12,0,7,2
PURVAJA Women’s Bodycon Knee Length Dress (Ruby-371-379),0,0,0,10,10,0,0,0,3,0,0
Lymio Tops for Women || Tops for Women Women Tops || Tops || top for Women || top || Women top (474),0,14,7,0,7,0,0,9,0,0,0
FUR JADEN 15.6 Anti Theft Laptop Backpack with USB Charging Port Unisex Bag for College Office Suitable for Men Women,7,10,0,0,0,5,0,5,0,15,0
SHOPEE NIKKOR Z DX 16-50mm f/3.5-6.3 VR Lens on Nikon Z50 Zfc Z fc Replace for Nikon HN-40 Lens Hood Compatible w 46mm Cap...,0,5,6,4,21,7,10,7,5,3,6
"Camera Shutter Button, Upscale and Delicate Soft Shutter Release Button (3 Pack)",6,8,15,10,3,17,14,21,8,17,9
M Medler Apricate Nylon 55cms Cabin Size Waterproof Travel Duffle Bag- NAVYBLUE,0,13,12,12,10,14,0,0,6,11,0
"SPIN CART 3.5mm to RCA Cable, 2RCA Male to 3.5mm Male Stereo Y Splitter Audio cable Compatible with Phones, Laptop, HDTV, ...",0,0,0,0,0,0,0,0,13,4,0
"Dyomnizy One Side Ultimate Travel Neck Pillow Adjustable Best Accessory for Airplane, Auto, Bus, Train, Office Rest Inflat...",7,20,2,30,7,25,26,15,12,2,7
FASHION VICTIM 106 Men's Running Sport Shoe,4,1,14,5,4,7,17,27,17,10,8
SQKURTI Women Rayon Printed Long Kurta,0,0,11,3,6,5,5,6,0,0,0
FRENCH CROWN Periwinkle Blue Royal Oxford Shirt,6,2,0,6,4,0,0,0,5,2,5
"Casio FX-82ES Plus 2nd Edition - Non-Programmable Scientific Calculator, 252 Functions, Black",10,0,4,0,0,17,5,0,12,5,0
b z Sasta Bazar Mens Printed Slim Fit Stretchable Jeans,7,7,17,5,26,9,0,11,29,15,0
Liberty Men Miller-5 Sports Shoes,0,19,17,22,3,0,5,4,0,0,0
YouBella Jewellery Gold Plated Charm Bracelet for Girls and Women (Style 1),1,17,6,13,12,29,4,14,0,26,26
LALITA HANDICRAFT Floating Wall Shelf Rack for Home Décor Display Units Showcase Book Rack for Study Room | Wall Mount She...,6,0,2,0,9,0,16,8,4,0,0
Nasher Miles Lombard Hard-Side Cabin Luggage|Grey 24 Inch /65CM Trolley/Travel/Tourist Bag,15,0,3,11,23,12,9,0,11,12,0
Sidharth Gems 9.25 Ratti 8.00 Carat Cultured Yellow Sapphire Gemstone Certified Cultured Pukhraj Stone Lab Tested Astrolog...,3,0,3,0,0,0,7,0,0,0,0
"Enamic UK Wall Fan K-239 Copper Touch Powerful Motor 12 Inch Wall Mounted 300MM Limited Edition || Wall fan for office, Ho...",0,12,20,19,0,7,0,0,17,9,0
"Puma Unisex-Adult Fabian Puma Black-Nrgy Yellow Running Shoes (8 UK, 19101503)",13,13,0,5,8,2,10,5,7,4,0
Simon Carter Men Jeans,9,16,4,12,14,11,10,8,13,19,15
KIROH Analogue Unique Multi Flower Dial Designer Leather Strap Women's and Girl's Watch (Green),21,11,0,26,15,6,16,6,19,8,0
BIBA Womens Round Neck Solid Palazzo Suit,4,0,0,0,3,0,0,0,0,0,0
Analog Black Dial Men's and Women's Couple Watch -Black DD+Magnet,0,3,22,15,6,0,5,0,0,2,0
Sabates-Men's Formal and Casual Wear Height Increasing Slip-On Stylish and Latest Shoes White,15,28,16,0,1,12,0,0,11,7,7
"RISHABH DIGTIAL MULTIMETERS RISH IYOUNG, Multi, Medium (RP1412)",9,20,6,19,4,15,2,5,11,26,0
Dixcy Scott Men's Cotton Regular Trunks,7,9,4,0,0,0,0,9,0,6,0
"Kuber Industries Cotton Oval Door Mat for Porch/Kitchen/Bathroom/Laundry Room,(Black) 54KM3948",0,0,7,4,0,10,6,0,0,13,0
PUMA Men's Cool Cat Sport Slide Sandal,0,0,0,0,7,0,6,0,0,8,0
Lee Men's Slim Jeans (LMJNSM3832_Black,0,0,11,0,0,0,5,0,5,7,0
"Fancy Steps Baby White Wings for The Baby, The Texture is Beautiful and The Band is Elastic, The White Wings for a Newborn...",3,6,0,12,0,0,0,0,0,0,0
"R RILO Women's Cotton Embroidered Maxi Nighty (RB-618-XL, Brown, XL)",1,0,10,12,0,11,10,7,6,11,6
Raw Pressery Almond Milk Plain Unsweetened 1 LTR (Pack of 2),4,0,6,0,2,0,0,0,0,0,0
LUX COTT'S Wool Men Regular Fit Thermal Top (Cott1_Black_Top_FSO_1Pc_Black_90Cm),13,0,8,11,15,11,0,3,3,8,16
PC Jeweller Rose Gold and Solitaire Ring for Women,13,8,7,0,16,5,7,7,4,9,4
"cello puro steel-x benz insulated bottle with stainless steel inner, 900 ml, black",5,14,0,0,6,8,0,0,0,4,0
"SanDisk 500GB Extreme Portable SSD 1050MB/s R, 1000MB/s W,Upto 2 Meter Drop Protection with IP55 Water/dust Resistance, HW...",2,0,7,10,4,2,26,0,0,4,0
"INKBIRD Vacuum Sealer Machines,80kpa one-touch Automatic food preserving machine with sealer Bags storage and built-in cut...",15,2,4,12,0,0,6,17,8,18,0
Oswim Wooden Finish Deco Whisper Mini Exhaust/Ventilation Fan(150mm/6 Inch) (Light Wood),1,0,0,0,2,4,4,6,0,0,0
COSCO CGC-60 Group Cycling Bike,10,4,10,1,10,13,4,3,6,6,0
"Wonderchef Luxe Multicook Stainless Steel 1.2 L Electric Kettle, 1000W, Red with egg boiler attachment | 2 in 1 | Breakfas...",2,0,0,4,0,0,0,4,0,0,3
Spykar Men's Regular Fit Cotton Jeans (RONOS005),4,0,4,6,0,0,0,5,5,0,0
uxcell 1500W Kilns Furnaces Casting Heating Element Coil 57.5cm Long Silver Tone,0,7,0,19,0,0,7,0,0,6,0
ZEPAD A006 125 Watt Wireless Bluetooth Portable Speaker for Home Party (A006 Black),22,5,9,0,10,0,0,17,10,13,8
"INLAZER-3 Inch Hidden Height Increasing Sport Shoes for Cricket, Football, Basketball etc.",4,7,0,3,6,3,2,0,0,0,9
Adidas Men's T-Shirt,0,8,16,18,5,1,4,6,0,5,0
"Just Herbs Retractable 2 in 1 Herbal Eyeliner + Kajal with Almond Oil & Vitamin E, 11 Hour Stay, Singlestroke, Smudgeproof...",3,0,0,0,2,5,9,0,0,0,4
I A Chikan Pure Cotton Churidar White Pyjama for Mens.,13,9,8,11,7,20,15,7,0,6,0
KirtiGems 5.00 Carat Certified Unheated Untreated AA++ Quality Natural Hessonite Garnet Gomed Adjustable Silver Ring Loose...,21,1,0,0,28,0,0,5,13,7,6
ASICS DYNABLAST 2,4,0,0,0,0,0,0,0,0,0,0
ESSA Cotton Assorted Prints Men's Trunks,9,8,3,8,0,7,5,18,17,4,0
AJANTA Mens Copper Loafers,2,4,5,0,2,0,0,6,0,0,0
Kuber Industries Fridge Top Cover|Refrigerator Cover for Kitchen|Fridge Top Cover with Pockets and Handle|Non-Woven Strawb...,7,5,5,2,2,0,0,6,3,0,0
Sri Jagdamba Pearls Dealer Analogue Gold Dial Women's Watch - SJPVD935,8,23,14,5,17,6,0,0,7,15,6
"Pinkcity Gems 6.00 Carat American Diamond, Cubic Zirconia Certified Natural Loose Gemstone for Men and Women",8,7,12,6,10,13,11,11,29,5,0
UBJI Creation-Portable Electric Air Compressor for Car and Bike 260 PSI Tyre Inflatr Air Compressor Car Auto Pump for Moto...,0,0,0,3,10,13,0,12,0,0,0
ASTRID Pink & White Cotton Dhurry Girls Pouch With Tassels,0,10,14,0,16,5,0,5,11,0,6
The House of Tara Moss Green Canvas Sturdy Messenger Bag for Men and Women (HTMB 067_Green),7,0,0,9,17,5,21,4,0,8,2
BIBA Women's Polyester Salwar Kurta Dupatta,5,0,0,0,0,1,0,0,6,6,0
The Clownfish Faux Leather Sling Crossbody Messenger Bag,0,19,12,8,11,0,5,14,0,27,0
Bata Men's Formal Shoes,5,2,6,0,5,0,12,0,0,0,0
Anni Designer Women's Maroon Color Leon Crepe Printed Unstitched Patiyala Dress Material (POOJA MASTI 136_Maroon_Free Size),8,2,0,3,15,12,3,0,5,17,8
"ABSORBIA DEHUMIDIFIER for Rooms, Offices and Homes | 1.1 ltr tank, absorption capacity 300ml/ day | Automatic shut off | N...",7,0,0,0,0,0,3,0,0,7,2
Axter Men's Multi-Coloured Canvas Casual Shoes/Loafers/Moccasins - Pack of 3 (Combo-(3)-1002-1096-1058),18,22,31,20,17,0,8,13,11,19,11
Kirti Sales 14.25 Super Excellent AAA+ High Rated Alexander Colour Changing Alexandrite Stone Original Certified,0,6,7,15,4,2,0,2,0,5,0
Ravi Hi-Speed Cooler Pedestal Fan 500 mm (Black/Grey),7,10,0,0,3,0,0,0,0,6,0
VR Collections Men's Cotton Hooded Neck Hooded Sweatshirt,0,0,5,0,0,0,6,11,0,0,0
Campus Kid's SRM-07 Running Shoes L.Gry/V.ORG 8 -UK/India,25,24,33,14,7,15,3,34,19,17,0
