BARMUNDA gems 7.25-7.50 Ratti Certified Emerald Panna Panchdhatu Adjustable Rashi Ratan Ring for Astrological Purpose Men...,9,6,5,8,10,8,5,21,6,26,0
Puma Mens Deviate Nitro 2 Royal Sapphire-Elektro Purple Running Shoe - 11UK (37680709),4,0,0,0,0,9,4,3,0,0,0
LEOTUDE Men's Regular Fit Half Sleeve Polo T-Shirt,2,0,7,6,4,0,0,24,7,0,5
XForce Plaza UPF 50+ Summer Sun Visors for Women - Fashion Sun Visor Wide Brim Sport Beach Hat UV Protection Baseball Golf...,0,9,7,7,2,0,0,0,13,5,0
Titan Modern Bandhan Analog Blue Dial Unisex's Watch-NM17342569KM01 / NL17342569KM01,7,0,17,8,5,14,7,17,7,11,0
STARTER Men Solid White Sneaker(_8905672019867_White_7 UK_),14,0,9,16,19,10,9,0,10,0,0
Shopnet Wireless Bluetooth Speaker TG113 For LG K4 Ultra Boost Bass with DJ Sound Portable Home Speaker with Audio Line in...,11,13,23,15,0,3,20,0,28,0,0
M Men Style Genuine Adjustable Key Leather Cord Gold Black Bronze Leather Pendant for Unisex,0,0,0,7,0,4,4,4,0,0,0
ACCESSHER Gold Plated Traditional Vilandi Kundan Embellished Delicate Floral Design Clip On/Non-Piercing Nose Pin/Nath for...,16,11,18,21,5,8,20,21,27,35,17
Campus Men's ROLLZ Running Shoes,0,0,9,0,0,6,3,0,0,0,0
Michelangelo Silver Tie Pin With Cufflink for Men's (4 TYPES) (Square),11,13,10,6,0,15,5,11,10,26,20
Pepe Mens 5 Pocket Heavy Wash Jeans,29,10,5,1,0,17,7,0,11,5,0
GIVA 925 Sterling Silver Rose Gold Lucky Hearts Kids Nazariya Bracelet | Birthday Gifts for Kids | With Certificate of Aut...,0,12,4,0,3,4,1,6,5,8,0
Yellow Chimes Pendant for Girls Embracing Hearts-in-Love PAustrian Crystal Studded Pendant for Girls.,7,9,6,11,3,4,15,12,26,0,0
MTR MT901 Wireless Bluetooth Portable|Lightweight Mini Speaker|USB|FM|AUX|Memory Card Support for Indoor & Outdoor (Gray),18,21,16,12,0,10,30,7,0,0,0
"ShopAmz Camera with WiFi & Ethernet Connection, Alexa Google Assistant, Up to 256GB SD",14,0,13,16,1,7,16,5,0,10,10
KIROH Black Queen Magnet Strap and Diamond Studded Rose Gold Bracelet Combo Analog Watch for Girl's and Women (Pack of 2),0,10,19,11,12,5,0,7,1,7,0
Arrow Men's Regular Fit Shirt,4,24,7,16,11,4,0,3,0,12,4
"Maglite 2 Cell AA LED Mini Presentation Box, Black",5,9,5,0,12,27,8,20,3,11,0
NEVA Men's(Gents) 100% Cotton Vest in White Color.It is A 4-pc Pack!!,9,9,12,9,13,16,0,19,5,6,4
Axter Multicolor Men's Casual Sports Running Shoes (Set of 2 Pair) (2)-720-9324,7,2,8,14,1,0,5,0,13,0,0
Brado Jewellery Silver Plated Stainless Steel Chain For Boys and Man,4,6,16,0,24,14,12,8,5,13,0
Fruit of the Loom Men's Hip Brief,3,15,4,5,2,8,0,0,0,4,0
SAVIAURA 1 Sheet 2 in 1 3D Flat Lay Tabletop Double-Sided Photography Backdrop Photo Studio Flatlay Background PVC Wrinkl...,0,4,0,0,0,0,0,6,0,2,5
Peora Silver Plated Emoji Smiley Shirt Cufflinks for Men Boys Wedding Business Gift,10,27,8,10,27,17,7,15,0,3,0
TRIDEV Gemstone (इक्कीस फेस रुद्राक्ष) Nepali Beads 21 Mukhi Rudraksha Original Certified by Authority Lab for Men & Women,17,10,13,8,10,12,36,7,19,8,5
Dragaon Men's Stretchable Knitted Relax Fit Jeans,4,16,13,13,3,5,9,7,12,21,10
BIOWAY RO NRV (Non Return Valve) / Check Valve 1PCS (1/4 Pipe Size) Suitable for RO Reverse Osmosis System Domestic & Comm...,0,0,6,5,6,0,13,9,22,17,0
Hot Shoe mounting Foot for Godox V860IIS V860-S Flash Speedlite Repair Parts,7,6,13,8,12,6,10,0,6,0,0
Avsar 18k (750) Yellow Gold and Diamond Ring for Women,16,16,19,24,18,17,25,18,12,5,4
SLOWLORIS Advanture Men Round Neck Solid Maroon Printed Vest,9,14,0,12,0,7,0,9,5,0,0
Atasi International Blue Butterfly Crystals Gold Plated Party Necklace Set with Earrings For Women (GB5486),16,15,8,6,4,34,8,10,19,0,0
Puma Unisex-Adult Pwrframe Aerogram x One8 Black-Aged Silver Sneaker - 7UK (39277801),9,2,17,10,11,16,9,20,16,6,0
AVSAR 18k (750) White Gold and Diamond Nose Ring,7,16,8,6,3,15,11,10,5,21,0
Trendy Shoes Men's Synthetic Shoes Lace-Up Formal Shoes C-74,0,11,12,0,5,0,9,17,0,4,0
Stylum Women's Cotton Blend Salwar Suit Set (Off White_XS),6,14,10,7,18,17,6,17,0,1,0
IndyDukaan 9 mm USB Borescope Inspection Camera Waterproof Snake Camera 6-LED 2m,4,0,0,3,4,2,2,0,11,6,0
F Gear Adios Polyester 31 Liters Black Red School Bag,2,0,15,0,6,0,2,18,10,0,5
Rechargeable Li-Ion Battery Select for Olympus Cameras (LI-50B),10,16,5,0,3,17,15,6,8,0,7
Xs and Os Women Embellished Bikini Bra Panty Lingerie Set with Thigh High Socks,0,17,13,12,14,4,11,20,9,13,0
THE BLAZZE B4065 Women's Cotton V Neck Elbow Sleeves Adjustable Drawstring Crop Top Readymade Saree Blouse for Women,0,0,7,0,0,0,0,0,0,0,0
Luxula 4 in 1 Hanging Roll-Up Foldable Portable Detachable Cosmetic Organizer Bag Makeup Pouch Travel Toiletry Bag for Wom...,0,9,10,4,3,0,0,10,20,0,3
Kobo Stud Football Active Shoe (Imported),3,14,8,0,7,0,5,0,0,3,4
Creatick Studio Shree Radhe Car Decal Sticker,0,4,7,0,6,9,0,0,0,0,0
QOXOLYZ Women's Seamless No Show V Shape line line Ice Silk Panties Underwear Multicolor Hipster- Pack of 3,8,29,13,15,13,19,1,18,29,15,0
Shopnet Wireless Bluetooth Speaker TG113 For Lenovo A6600 Plus Ultra Boost Bass with DJ Sound Portable Home Speaker with A...,9,16,19,21,9,3,12,14,10,13,0
Aglance 7006 Flower Owl Women Watch,27,13,15,7,5,22,21,15,10,20,4
"Upix® AC Remote No. 90 (with Backlight), Compatible for Samsung AC Remote Control (Exactly Same Remote Will Only Work)",0,0,7,2,13,11,6,0,7,20,7
POXEFLIP Portable Travel Necessaries Bra Bag Underwear Bag Organizer Small Compact Bra Cover Storage Box Panties Socks Fin...,16,16,16,3,14,8,15,7,14,18,3
Fashion OVERSEAS BEADED WOMEN POTLI BAG (ZPP-361),5,0,7,0,0,0,15,7,0,7,0
FOGGMART Silver Color Stainless Steel Lord Shiva Murti Round Pendant Locket Set For Men Women Boys & Girls Stylish Fashion...,3,6,2,5,0,0,0,18,7,12,0
"ROYAL STEP Portable Electric USB Juice Maker Juicer Bottle Blender Grinder Mixer, Rechargeable Bottle with 4 Blades (MULTII)",0,0,15,7,6,0,0,0,0,6,0
Anand Sarees Women's Georgette Saree With Blouse Piece,6,12,0,21,10,27,12,6,7,1,4
"Huesland by Ahmedabad Cotton 144 TC Cotton Bedsheet for Double Bed with 2 Pillow Covers - Grey, Blue & White",0,2,0,0,0,0,0,0,0,8,0
Indigo Women's Bermuda Shorts (Pack of 2) (AW21/BLC-118_Blue+ Beige_M,1,0,4,7,5,4,11,12,2,13,0
MileStore Portable Handheld Cordless Car Vacuum Cleaner Wireless | Portable Small Wireless Vacuum Cleaner | Strong Vacuum...,6,9,2,4,7,8,7,15,15,5,6
SOUTH TREE Girls Trackpant Net Folding(Pack of 3),6,7,23,12,8,0,0,10,0,11,0
ZAVERI PEARLS Rose Gold Contemporary Cubic Zirconia Mangalsutra Bracelet For Women-ZPFK12638,10,39,9,26,6,2,4,9,13,9,0
Monte Carlo Men Shirt,14,0,7,14,5,7,16,8,12,9,0
"Quantum SONOTRIX 41, Bluetooth Speaker, Powerful Bass, 5W Sound, 19hrs Playtime, MicroSD Card, AUX and USB Input Support a...",4,0,0,16,25,7,10,0,6,10,5
"IFITech Home Security WiFi Mini IP Camera, 720P HD Night Vision Wireless Indoor Security Surveillance System, Motion Detec...",3,7,12,8,0,3,15,0,0,10,5
DMJ (20Inch 22K Finely Detailed Men's Chain in Gold Plating Gold-plated Plated Brass Chain,0,0,0,10,22,2,3,3,0,0,0
ishin Women salwarsuitset,7,5,6,0,9,33,0,7,7,5,0
Decode Car Center Wooden Armrest/Console for Maruti Suzuki Swift Dzire 2017 onwards (Beige),0,4,11,8,13,6,9,10,8,5,3
Savani Fashions Hand Purse | Cotton pouches for Women | Multipurpose pouch For Women Off White Canvas,6,0,0,0,3,0,12,0,0,5,0
"FAVONE CCTV Camera WiFi , 360° Panoramic Camera Bulb, Security Bulb Camera WiFi Outdoor 2.4GHz WiFi Home Security Cameras ...",8,4,1,5,13,0,0,0,7,1,0
POLICE Men's Leather Coin Wallet with Card Holder Compartments Gents Purse (Black),16,13,3,10,0,6,1,12,9,6,0
Walkaroo Boys Black Grey Loafers - 6 UK (WY3301),0,4,0,0,0,0,4,0,7,0,0
Peter England Men's Regular Jeans (PJDNJCTFE92234_Medium Grey_34),7,0,19,14,10,5,4,12,15,5,0
AYIKA Secret Wrist Watch Camera Full HD 1080p Video and Audio Indoor Outdoor Recorder Upto 3 Hours Recording Time with 32G...,0,6,16,6,0,1,2,3,0,0,0
Aeoss transparent fashion Socks Silky Anti-Slip Cotton Sole Sheer Ankle High Tights Hosiery Socks for Women and Girls (Set...,2,6,0,6,0,0,0,0,0,0,0
Malabar Gold and Diamonds 22k (916) Yellow Gold Drop Earrings for Women,0,8,7,7,0,10,0,22,8,11,0
SHOWOFF Men's Navy Blue Mandarin Collar Gingham Checks Classic Fit Shirt-WonderChecks-1725_NavyBlue,17,7,0,25,6,11,14,7,16,31,8
"Shoetopia Women's Casual Outdoor Comfortable Trendy Bellies Flats,Multi-Pink",0,17,0,0,0,0,4,0,0,4,5
Fusefit Men's Compact Running Shoes,16,14,8,20,35,14,14,3,9,9,16
"Sekuai ® Wireless WiFi 960P HD 1.3 MP 360° with Light, Two-Way Audio Bulb Shape Fisheye Panoramic CCTV Remoting Monitoring...",0,5,0,1,0,0,0,6,0,0,0
Carlton London womens Cll-6649 Flat Sandal,11,20,18,4,6,8,7,5,11,2,5
BREEZ Boy's Cotton Full Sleeves Sweatshirt with Pant,4,6,18,7,16,0,0,7,2,0,2
Generic Polyster Light Weight Laptop Bag 30 ltrs Laptop Backpack for Upto 15.6 inch Laptop-ALB_1XR00465,9,14,4,13,13,0,15,31,2,10,0
(Renewed) DIZO Wireless Dash Bluetooth Headset (Electric Blue),6,11,23,0,10,5,0,18,22,4,13
GO SMART Men`s Cotton Underwear (Pack of 3) | Multicolour Brief/Underwear/Trunk for Men | (Size-90),0,5,5,0,0,5,9,7,6,0,0
ONLY Fit & Flare Jeans (263596001_Black_36),7,4,0,10,0,16,0,15,17,5,0
one8 by Virat Kohli Men's Brief (Pack of 3),4,6,7,0,22,8,9,0,0,18,3
Van Heusen Women Wallet - Small Square Flap,0,0,7,5,5,0,0,0,0,0,0
"EGate L9 Pro Full HD LED Projector 1080p Native, Android 9.0, 8400 Lumens (750 ANSI) 4K Support, 4P/4D 45° Digital Keyston...",2,5,0,1,0,0,0,0,8,0,0
Toxi Holi T Shirt Special Happy Holi Kids Sizes,3,5,13,0,5,0,11,15,20,6,0
Sonata Beyond Gold Analog Blue Dial Men's Watch-NN77108NL01W/NP77108NL01W,0,1,0,12,12,15,4,9,0,11,0
Style Quotient Women White Shrug,0,0,0,3,0,1,0,4,16,0,0
Campus Men's Center Running Shoes,6,9,0,0,0,5,0,8,7,0,6
FREDI HD PLUS Bluetooth Earpiece GSM Card Spy Hidden Wireless Full HD with Clear Voice with Dual Way Talking Device,1,0,9,14,14,0,10,7,21,9,0
"Aircum Men's Lightweight Casual Loafer Sneakers Shoes (FIROZI, Numeric_10)",0,6,0,0,0,0,2,3,5,11,0
SAMSONITE Evoa Polycarbonate 69 cms Brushed Silver Hardsided Check-in Luggage (SAM SP69/25 EXP-Brushed Silver),0,2,4,12,6,0,14,7,26,7,21
"Orei 4K 1x2 HDMI Duplicator Splitter by OREI - with Scaler 2 Ports with Full Ultra HD, HDCP 2.2, 4K at 60Hz 4: 4: 4 1080p...",5,14,0,16,8,0,0,16,18,16,0
Om Jewells Combo of Crystal Blue Exquisite Rhodium Plated Pendant Necklace Set and Bracelet for Women,7,6,8,6,0,0,9,0,5,6,0
XL Multi Purpose Sewing Machine Silicone Lubricant Oil 100ml,0,0,11,0,0,0,0,5,4,0,7
BATA Men's GRID-Remo-AW17 M1 Black Formal Shoes - 8 UK (42 EU) (8516139),0,8,11,15,19,11,1,7,4,0,0
"Geek Aire GF11 5 Inch Rechargeable Mini Table Fan with LED Light | Portable, Small Size and USB Charging |Easy Button Cont...",0,0,6,0,0,6,2,0,0,0,0
Zoom Shoes Mens Boot Fashion Boot,0,0,0,0,0,0,0,0,0,5,1
Fablab Women's Viscose Solid Calf Length 3/4th Lace Capri Pack of 2 (Waist 24-32 Inches),0,0,1,0,0,0,0,0,0,0,0
"Fast&Up Creatine Monohydrate (Pack of 250 gms Powder, 83 Servings, Unflavored), Helps Sustain Longer Workout, Muscle Repai...",6,10,10,0,21,6,0,9,6,0,0
"Style and Culture Women's Potli for Return Gift Wedding (Set of 10, Gold)",7,7,0,0,0,0,7,16,0,0,0
HEERA MOTI CORPORATION Flexible Engineered Wood Bookshelf Display Shelf -Free Style Display True Natural Stand Shelf Rack ...,10,0,19,0,17,3,21,14,7,0,0
SANA Nightwear Soft Cotton Nighty/Night Gown/Sleep Wear for Women with 1 Side Pocket -SN1403-GRP,0,0,0,6,0,0,0,0,0,0,0
Zero Stitch Women's Georgette Sequence Work Kurta Palazzo with Dupatta Set,0,0,0,3,0,0,0,0,0,0,0
Puma Mens Camo V3 Sneaker,3,16,9,5,16,0,27,12,5,16,0
"Mala's Mala Kokum Cordial Fruit Drink - 750ml Bottle, 750 g",11,0,3,0,0,0,0,0,0,0,0
Prestige PKLSS 1.7 Electric Kettle 1.7L,2,0,0,0,0,0,12,3,0,6,0
AMUL (Pack of 3) Comfy Trunk/Underwear/Brief for Men,4,0,3,10,11,0,7,1,8,14,3
"Seagate Ultra Touch 1 TB External HDD USB-C USB 3.0, 1yr Mylio Create, 4 Months Adobe CC Photography Plan, and 3-Year Resc...",0,6,0,0,5,0,7,0,0,0,0
"Hopscotch Baby Boys and Baby Girls Synthetic/PU Graphic Print Applique Casual Shoes in Blue Color, UK:3 (FWS-4330297)",8,0,0,8,1,7,6,0,3,33,14
Milisten 60cm PU Leather Handbag Handlesï¼Œ2 Pcs Tote Bag Strap Bag Belt with Rivets Accessories for DIY Woman Pouch,12,20,2,11,12,10,5,17,9,7,0
cloudbox Tropical Floral Printed Knee Length Soft Silk Kaftan Top (Free Size) Multicolour,0,0,0,0,0,5,10,0,0,0,0
LTYNE Womens Dupatta Multi Colour (Cream),10,24,17,6,17,8,9,5,11,0,14
Natural Red Carnelian Tumble Stones for 500 Grams Tumble Stone,2,5,24,0,0,0,0,13,0,0,0
I2SERVICES Badminton NET Cotton 21 FT X 2.5 FT Nylon (Brown),3,9,0,0,6,0,0,3,0,0,0
Men's Stylish Casual Chelsea Slip-on Ankle Boots,5,0,16,2,4,0,14,13,7,0,0
ASICS Men's Gel-Nimbus 23 Running Shoes,7,4,0,7,15,0,0,0,0,2,0
Shritikas Women Cotton Kurti | Formal Wear Kurti | Staight Kurti | Extra Big Size Kurti | Cotton Kurti with Pocket | Offic...,0,0,0,0,9,4,5,7,0,0,0
LEADERACHI Vintage Hunter Leather Messenger Bag | Office Bag Sling Cross Body Travel Office Business Messenger one Side Sh...,0,0,4,0,0,0,0,0,0,0,0
UJEAVETTE Tactical Vest Plate Carrier Assault Jacket for Men Women Outdoor Protective Camouflage,0,0,6,6,11,11,6,11,7,7,0
Birthday Popper Emoji Smiley Theme Slap Bracelet Bands | Pack of 12 | Birthday Return Gifts for Boys and Girls Birthday Pa...,0,0,0,7,0,4,17,0,9,0,4
FENTACIA Men Casual Loafers,5,3,0,0,0,0,4,0,2,0,0
crocs Classic Platform Glitter Flip,22,13,3,5,5,6,6,6,0,22,0
Selvia Natural Black Onyx Beads Bracelet Crystal Round Stone Adjustable Hand Band Avoid Negative Energy Wristband for Men ...,6,0,0,0,0,5,0,0,2,6,3
BERING Analog Blue Dial Men's Watch-16940-799,7,0,0,0,0,5,0,0,0,0,7
Invincible Men’s Nylon Sauna Suit,20,19,8,9,0,20,6,10,0,0,4
M MEDLER Epochbox Polyester 55 litres Waterproof Strolley Duffle Bag- 2 Wheels - Luggage Bag (Wine),6,8,0,12,0,0,11,3,10,13,7
Aqualite Mens Neo00151gwhbk Flat Sandal,5,23,3,10,2,6,13,3,0,22,3
Liberty Men LSS-132 Formal Shoes,0,0,0,5,1,8,6,5,0,15,0
OM® Meters EDM-80 Desk Stand Analog 0-50mA DC Milli Ammeter | Ampere Meter | Meter For Educational purpose | Black,0,0,21,0,5,0,0,3,3,8,0
"MAGGI Magic Cubes Vegetarian Masala, 240g | Ready Masala for Vegetables, Rice, Curries & Dals",13,13,4,18,8,3,5,0,8,13,0
Lee Men's Skinny Fit Jeans,6,10,9,0,4,0,0,16,0,11,7
"Radhya Fashion Babydoll Lingerie for Women, Honeymoon Dress for Girls, Spcial Night Dress, Lingerie for Women for Sexy Hon...",6,0,5,9,0,0,0,0,0,0,0
ShopsNice Earphone in-Ear Headphones for Xiaomi Redmi Note 8 Pro Earphones Wired Stereo Bass Head Hands-Free Headsets Earb...,0,8,16,7,9,19,17,11,14,9,0
Mikado Blue 2 Gift Heart Set Women and Grils,8,1,0,8,0,0,3,0,9,8,0
FREDI HD PLUS Spy Camera Hidden Wireless Mini WiFi USB Wall Charger Camera with Remote View HD 1080P Video Audio Secret Re...,10,11,5,0,18,6,17,15,8,11,0
"AUTO MT Heavy Backrest Backrest Support Pillion for Bajaj Dominar 400 250, Pack of 1, Black",0,10,4,16,6,15,13,16,8,12,0
"HOJI Mobile Phone Chest Strap Mount GoPro Chest Harness Holder for VLOG/POV, with iPhone 13 Pro Max Plus,Samsung,GoPro Her...",0,0,0,6,4,0,0,0,0,0,0
Rhysley Cotton Light Blue Solid Regular fit Jeans for Men | Perfect Light Blue Denim Shade,16,4,18,16,16,21,3,18,13,18,0
"""MILLETS Flash Hot Shoe Heavy Duty Clip Clamp Flash Reflector Holder Mount with 360° Swivel Ball Head Standard 1/4"""" Screw f...""",13,19,3,0,7,5,19,18,3,5,0
"RMAX Women Felt Purse Organizer Insert for Ladies Handbag, Tote, Shoulder Hobo Bag Storage Purse Divider, Multiple Storage...",0,0,3,0,8,16,3,6,3,6,0
"JARANI Cotton Handmade Mirror Work Hand Purse for Womens/Girls-(Pack of 2,Black & Blue)",2,0,9,0,0,0,0,0,0,4,0
Lux Cozi Cotton Assorted Solid/Plain Men's Mini Trunk (Bgsht-PL-Mini-Assorted),0,5,2,25,0,8,12,11,20,5,0
EVER LOVED Women's Cotton Top & All Over Strawberry Print Pyjama Set/Pajama Night Suit Set/Sleep wear Set/Loungewear Set,7,12,5,4,9,0,15,8,7,17,8
LG LED TV Black Size 50 inch,3,7,5,0,0,12,0,0,2,0,6
Narsingha Dreams Women's Cotton Hooded Sweatshirt,11,9,4,5,8,11,13,13,0,0,11
Lee Men T-Shirt,3,0,16,19,0,15,9,17,15,13,11
Mamaearth Milky Soft Natural Baby Face Cream for Babies 60mL & Dusting Powder with Organic Oatmeal & Arrowroot Powder 150g...,1,9,6,4,4,11,0,6,1,6,7
Brandway Portable & Foldable Gazebo Tent & Pop-up Canopy Tent 7x7 Ft / 2 x2 Meter (Red),2,0,0,1,0,8,3,0,2,0,6
Amazon Brand - Tavasya Women's Relaxed Bottom (210_White_XL),10,21,0,10,0,10,19,0,7,31,3
ASIAN Eco-Friendly Jute Bags-Reusable Tiffin Shopping Grocery Multipurpose Hand Bag with Zip & Handle for Men and Women,9,6,0,19,0,11,13,17,20,21,2
"Nivia 993 Polyester Football Stocking, Small (Sky Blue)",7,20,5,10,13,7,2,6,0,2,0
"Men's Slim Fit Denim Mid Rise Stretchable Jeans (Dark Grey, 30)-PID42894",0,0,0,9,3,6,13,0,7,0,6
AKSHITA GEMS 9.25 Ratti 8.00 Carat Certified Natural AA++ Quality Panchdhatu White Fire Opal Loose Gemstone Silver Plated ...,0,0,0,0,0,0,0,0,0,9,0
"Ridhi and Sidhi Women's Cotton Plain Fully Stitched Saree Petticoat (Black, 40 W x 30 L)",27,8,5,22,5,0,3,3,3,0,6
Red Tape Men's Running Shoes,8,0,13,6,3,5,0,20,4,4,0
EVEDA Synthetic Leather Classic Trendy Travel Shoulder Top Handle Handheld Unique Design Water Resistant Handbag For Women,8,5,27,2,18,4,9,14,3,13,0
Arrow Men's Solid Cotton Dobby Weave Slim Fit Formal Shirt,1,4,4,11,16,8,2,2,7,1,0
Clarks Roxby Lace White Canvas Synthetic Shoes,3,0,0,6,15,5,2,0,0,0,0
Lazer Aqua Therm ISI Certified 1500 Watts Copper Shockproof Bakelite Body Immersion Rod Water Heater (Black),2,0,0,0,0,0,8,4,0,0,0
WorldCare® 6pcs/Pack 75mm/3g Soft Fishing with Scents : Gundy,0,0,0,0,0,0,0,0,0,3,0
Skechers Mens Go Run Tr-Torch Running Shoes,19,7,6,10,0,8,13,11,0,4,20
Meister Figure 8's Weight Lifting Straps - Neoprene Padded (Pair) - Black,5,8,5,5,18,0,12,8,24,2,0
dockstreet Boxer Brief Comfortable Stretchable/Soft Brief Trunk Styled Underwear for Men,18,2,5,19,0,12,3,13,12,0,0
Vector X RS-7150 Jogging Shoes (Royal-Navy) (Size-10),0,0,0,4,0,0,0,0,0,0,0
"BKN® BuyKarNow Ultra Flexible Gorilla Tripod for Mobiles, DSLR & Action Cameras with Mobile Monopod Holder (13.5 Inch with...",8,9,14,18,0,7,11,12,5,32,6
Zuvim Baby Girls Pleated Knee Long Printed Satin Dress,0,0,4,0,0,3,0,2,4,7,4
Birde Premium Casual Shoes for Men,0,3,18,0,18,6,0,7,4,4,0
"DAMENSCH Deo-Soft Men's Odour-Cancelling Supima-Modal Soft Trunks- Pack of 3- Grey Green, Space Grey, Denim Blue- XX-Large",4,34,23,0,15,0,14,12,5,0,0
Senco Gold 22k (916) Yellow Gold Stud Earrings for Women,9,0,5,16,7,21,22,21,5,0,0
"Shopnet Wireless Bluetooth Speaker TG113 For Lyf Water 7, Micromax Canvas 5 E481, Vivo Y55L, Samsung Galaxy On7, Lenovo P...",0,0,0,0,0,0,0,0,6,0,0
Red Tape Men's Moccasin,4,14,7,5,2,13,13,5,17,35,0
"divinezon Polyester Foldable Portable Pop Up Cloth Changing Toilet Tent for Camping Hiking and Picnic, (120 X 120 X 190 c...",7,3,6,0,0,4,8,23,0,4,7
MALENO Men's Thermal Pajama (Pack of 2),0,12,7,4,5,0,0,5,0,0,0
Campus Men's Kent PRO Running Shoes,6,3,9,0,0,0,0,3,11,0,0
Happi Doggy Dental Chew Care Honey & Coconut Oil Dog Treat - Single - 25 gm,6,0,4,2,10,10,3,3,0,4,0
ADAMO Slim Blue Dial Couple Combo Wrist Watch AD7172SB05,6,5,3,4,10,14,8,7,12,0,0
Shoetopia Stylish Pumps for Girls,0,5,0,20,4,0,6,6,8,0,0
"Ovuro Clear Toiletry Bags, Travel Makeup Bag, Waterproof Cosmetic Bag Clear PU Zippered Makeup Bag Portable Toiletry Wash ...",10,8,8,0,0,7,12,6,5,11,11
"Navkar Crafts Unisex Cotton Bikers Motorcycle Riding Skull Face Mask Protection (Black, Large Pack of 1)",6,4,6,0,5,13,5,11,7,0,0
Jeans For Mens For Smartness.(pack of 2),7,20,28,42,27,31,17,23,6,11,0
Peter England Men Jeans,0,3,0,11,10,0,0,0,0,0,0
SCUBE Fashion Women Rectangular Kourtney Sunglasses with Side Glass and UV400 Protection (White-Brown),0,0,0,2,0,0,5,0,0,0,0
"Style98 Style Shoes Leather ATM Credit Card Holder Cum Pocket Money Wallet for Boys, Girls, Men & Women (Brown PDM) (9164IB)",0,3,0,0,0,0,0,0,0,4,0
Memoir Gold Plated Black and Gold Plated Child Bangle Kada Nazariya for Kids (0-1 Yrs),0,0,0,0,6,0,0,0,0,0,0
"Nike Men's Gymnastics Shoes, Black/Oil Grey, 8.5",0,0,0,0,0,0,0,0,0,0,2
Zivom® Rope Leather 316L Surgical Stainless Steel Wrist Band Strap Bracelet Boys Men,0,9,0,0,5,0,0,6,0,0,6
Spykar Men's Skinny Fit Jeans,0,0,11,5,0,5,12,0,0,7,0
Proline Mens Track Pants(PA24522L_LE),26,2,6,11,15,11,16,7,9,0,0
GM816 Digital Wind-Speed Backlight Airflow Gauge Meter Anemometer Thermometer H02 828 Promotion,0,10,25,2,3,35,10,11,12,8,0
Joyalukkas 22k (916) 4 gm BIS Hallmarked Yellow Gold Precious Coin with George head Design,11,3,9,12,2,16,26,12,12,5,0
AmazproCombo Pack of 2 Items - HM1000 Business Purpose Wireless Bluetooth V4.0 Earphone with Immersive Sound and Hands Fre...,19,7,0,10,5,2,25,17,11,12,8
Don Diego Mens Dd7007_Bordo Uniform Dress Shoe,5,10,16,9,10,6,26,16,1,28,6
"casdino night driving glasses, unisex, eye-wear for day and night, yellow color, sunglasses for bikes and cars, rectangle ...",5,0,5,0,0,0,6,10,0,4,0
ASTRAL Luxury Analog Watch for Women Stylish (Red) | Pack of 2,0,2,3,5,15,11,9,5,21,10,0
Amazon Brand - Myx Women Pajama Bottom,17,0,6,0,0,7,0,6,9,13,0
THREE PM Waterproof 4k 16MP Action Camera Full HD Action Cam 30m/98ft with Mounting Accessories 2.0 inch for Youtuber Bike...,0,0,0,0,7,0,2,17,0,5,0
The Amazon Choice Black Logistics/Courier/Parcel/Luggage/Grocery Delivery Bag Waterproof with Rain Cover 127 Litre Superb,3,4,7,3,0,0,0,0,0,0,0
Diamo Cotton Embroidered Paper Mirror Work Dupatta For Womens Pack Of 2,0,0,0,0,0,9,0,0,0,6,0
iSTAR TV Set Top Box Stand with Remote Holder Wall Mount Shelf DTH Stand for WiFi Router Stand All Type of Set Top Box (Bl...,0,7,0,1,0,5,8,5,2,7,0
Prestige PIC 16.0+ 2000W Induction Cooktop with Soft Touch Push Buttons (Black),0,0,0,0,0,6,0,3,0,0,0
PUSHKART High Speed Mini Wall Cum Table fan 12 inch Size 3 Speed Setting With Copper touch Motor Black Fan 300 mm Table fa...,10,7,9,5,7,12,8,13,1,7,0
"Grace MB-412 Wooden Portable Wireless, Bluetooth Speaker (Black)",7,2,16,0,0,13,24,30,20,3,0
"Samsung 7 Kg 5 Star AI Control & Wi-Fi, Fully-Automatic Front Loading Washing Machine (WW70T502NAN1TL, Inox, Digital Inver...",10,0,8,0,0,9,3,12,27,0,0
HammerSmith Men's Casual Millennium Fit Shirt (HSCSM056_Light Grey L),10,6,0,2,0,10,3,0,7,2,0
"Astroghar Mini Hand Tally Counter Finger Ring Digital Electronic Head Count,Japa Counter Mini Hand Tally Counter Finger Ri...",0,0,0,2,3,0,0,5,2,0,0
Latest Fashion Sport Shoe_The Shoe Kart TH-KR-02 Multi,13,10,10,21,0,18,23,17,19,4,4
Royal Enfield 1990722 Black And Silver Slashcut Silencer-IN for Classic UCE 350 (BS3 & BS4 Versions),2,12,0,3,0,16,10,0,4,0,0
CAVALLO by Linen Club Pink Printed Regular Fit Casual Shirt,9,6,19,12,3,14,19,20,15,7,0
Puma Unisex-Adult Mirage Sport Tech Neon Sneaker,5,12,9,13,2,6,6,7,0,30,6
HERRYQEAL Women Lingerie Lace Chemise Sleepwear Babydoll Teddy Lingerie,0,17,6,0,0,10,0,0,0,0,1
Antiquestreet Customized Doctors Stethoscope Golden Keychain,4,0,14,8,0,0,0,4,0,8,0
"INDIA'S BIG SHOP Rosewood/Sheesham Wooden Hand Blender Butter Milk, Lassi Maker (12x3.5-inch, Brown)",0,11,0,0,5,0,6,9,0,0,0
PC Jeweller The Tahbert 18KT Yellow Gold and Solitaire Stud Earrings for Women,0,0,8,0,0,0,0,0,0,0,0
Campus Kid's SRM-09 Running Shoe L.Gry/RED 11- UK/India,0,0,18,11,4,0,5,14,4,0,0
"Himalaya Refreshing Baby Soap, 75g, Multicolor",15,16,0,27,5,15,18,25,4,17,4
Electvision Remote Compatible with Voltas Ac Remote Control (ac no 15) (Please Match The Image with Your Existing Remote B...,19,31,10,9,3,3,3,25,19,5,5
"Cathy London Women's Handbag, Material- Synthethic Leather, Colour- Black",0,11,17,10,6,13,0,19,0,0,0
Faynci Silver Long Drawn Cable Chain 120 cm Clasp Key Ring Metal Waist Belt Biker Racing Key Chain,0,0,0,4,0,0,4,0,0,0,0
Rangriti Women's Regular Tunic Shirt,6,7,9,7,0,3,6,31,0,17,7
"BATA Mens Harrier Lace Up Formal Shoes, (8246273)",0,0,0,0,0,0,0,6,0,11,0
American Bull Mens Regular Fit Clean Look 5 Pocket Jeans(Black_37),14,3,0,5,5,8,3,17,5,6,11
BXXY Men's Height Increasing Formal Slip-On Shoes,10,0,22,7,8,35,12,19,6,8,8
U.S. POLO ASSN. Men's Regular Fit Polo Shirts,17,11,19,7,19,13,34,7,6,11,4
JUNEBERRY® Oversized Loose Baggy Fit Drop Shooulder Half Sleeves Pure Cotton Stay Strong Graphic Printed Black T-Shirt for...,25,27,5,15,5,7,30,0,2,12,2
Snowball Stylish Lace Leggings for Women,3,0,0,0,4,0,11,0,11,0,0
artharvaa retail Handheld Carpet Sweeper Table Crumb Cleaning Brush Manual Plastic 4 Roller Cleaner Household Tool for Cle...,8,7,6,13,0,20,10,15,19,35,0
Trend Overseas Brown Black Women/Girl Women's Handwoven Crochet Macramé Bags Fringe Thread Rope Bag,0,0,3,0,13,18,19,8,12,7,0
Longwalk Men's Wingtip Brogues Dual Shade Formal Shoes,4,0,9,0,11,13,11,4,16,0,4
Puma Unisex-Adult Cape Idp Sneaker,19,6,0,27,8,3,0,9,8,7,6
Girl's summercoat and ladies summercoat/sun proetction coat/dust protetction coat/coat with scraf made up of 100% hosiery ...,9,12,4,9,7,7,0,0,6,12,0
Meekah Tess Leatherette Backpacks/Casual/School/College Backpack For Women & Girl,19,5,6,11,24,19,0,7,7,23,6
Joyalukkas Divino Silver Collection .925 Sterling Silver Vessels,6,0,11,0,20,5,22,0,2,11,4
"Bukaro Shoes VS-001-BLK,WHTE",14,4,20,16,10,13,0,0,11,9,7
"Miraan Cotton Printed Readymade Salwar Suit For Women(BANDCOLOR923, Pink)",2,9,27,13,9,9,19,17,17,17,0
Yellow Chimes Rings for Men Kpop BTS Band Jin Name and DOB Stainless Steel Silver Band Ring for Men and Boy's.,4,0,12,4,11,4,0,0,5,17,0
Peter England Men's Slim Fit T-Shirt,11,9,7,0,7,2,16,8,0,0,0
"Le Delite Unicorn Earphones mic,Cute Pink for Kids, Beautiful Headphones with Winder, Birthday Gift Girls Kids Cartoon Lea...",0,5,0,9,3,0,12,4,0,4,0
"Macmerise Rasta Splash 6W Wireless Bluetooth Portable Speaker with USB Support, SD Card, AUX, Upto 3hrs Playtime*, IPX7 Wa...",0,0,0,0,0,0,0,0,9,0,0
A2Z Shop In-Ear Headphones Earphones for Realme 9i In- Ear Headphone | Earphones | Headphone| Handsfree | Headset | Univer...,30,0,17,12,10,8,10,4,27,23,13
GIRISA Royal Blue Analogue Watch,0,20,21,6,7,30,6,6,14,10,2
Raymond Men Shirt,23,14,5,10,33,13,15,10,6,2,0
KLEIO Mutli Slot Crossbody Mobile Sling Wallet For Women/Girls (HO8035KL-DB)(DARK BROWN),39,6,7,0,0,2,2,12,7,8,6
